,text,emotion
0,stop even though they walk with the pure Rhine my dad was saved today shares,anger
1,As I do not understand only in CR passes this a couple of days ago the street fixed new prey and everything that was put on for 0 of the aya will come to break today person can be,anger
2,When you do not adra jente as well as poisonous when,anger
3,Person who controls the anonymous buy a lamb tray that supposedly was a cut leg and it was half leg and it brought me three garraons osea I eat a garrron hahaha person hdp with assorted truncated,anger
4,"Sorry and killed by taking poison for personal rats, the wife today is that it is debated in life and death suffering from the final stage of AIDS that strong and tremendous the blood of Christ about my marriage in the name of Person G",anger
5,How bad are we,anger
6,Blocking the people who treat me everything with bad words good people bad wave is better blocking I'm sorry ah do not forget Marilina or right-handed at 00000,anger
7,"""I believe that pensions will upload them"" a minute and a half of lies about pensions I was not going to touch them and go if they have trimmed with isabel towers bazan",anger
8,Person my husband cn the shirt of the chivas and according to him is american man of heart and now it turns out,anger
9,with my taxes pay these to be robbed,anger
10,CUSTOMS AND MORE CUSTOMS IS TRUTH IS NOT CHISTE AND ONE WITH UNIVERSITY TITLE AND GAINING BASIC SABRE,anger
11,X and think k is discrimination already is enough they are abusing,anger
12,While you ignore I fight while your mistreats I defend while your abuses I scream is already enough ignorance but while I live your voice will be,anger
13,On top of it,anger
14,to remove that fuck dictator,anger
15,Person ohhhhhh person with person person is clear person is ETA and supports terrorists to see what the Ind and the Aguirre say,anger
16,Sad but true,anger
17,Comment we do not have any kind of communication I'll start to delete I think you do not integrate my fb only use it for your games so it's that bye bye,anger
18,BEWARE,anger
19,Spreading is very bad mood smoking and giving to alcohol please q nó escape,anger
20,time person being too late,anger
21,FYI Public Service Notice Are Notified Nothing,anger
22,ecological revolt,anger
23,awareness and responsibility with your children because there is no reverse as I pass to this child now these holidays will not be able to open their gifts since it will be amputated from both hands sad but true,anger
24,Because you just buses in which you pay for a card that's why my contribution is all against tuc is the top already share this image we defend our rights of free mobilization,anger
25,Photo taken on Camino Real 00 East San Andrés Cholula where the not parking signal does not apply,anger
26,"After the ADO gave its advertisement of 00 now the Oxxo stores joins announcing their increases starting on January 0, what surprises will we continue to find CTMpeña",anger
27,What happened to the famous global warming that made a billionaire to the Vice President Person and it turns out that 00 States of the American Union are with temperatures below zero what are there any,anger
28,Person in the torax nothing that rest does not relieve and do not let more this type of abuse,anger
29,and by behind you get the knife you do not have a trust anyone because the one who thinks least of that is nothing of different I am tired person my family my country my jente not the canvio by nobodybuens,anger
30,PTM goes out of pendejos SSA staff all day and can not dezip me I am already up to the mother hateoooooo,anger
31,enter into,anger
32,Boicot A Coca Cola Do not buy this brand close 0 factories in Spain and dismiss employees to spread the message so that the whole world is known to be solidarity with these families thanks,anger
33,"So they are when the political campaigns that sadness start or speak, they greet are friends person who person",anger
34,She is deporting many of us who only came to work and have a better life and those who do not deport you make life impossible there to put trout in these choices people tag person,anger
35,They count,anger
36,Person but as I thought that they had already seated it in the electric siya because neither for broth serves,anger
37,This rear,anger
38,How do I get ridiculous wannabe my god do not see how ridiculous they look better than they stay at home and not trying to do things that have left us,anger
39,Viviana Carolina Garcia Marianella Elizabeth Loor Mendoza,anger
40,Something like that thousands of methods there are no murderous nobody has the right of person life to an innocent person,anger
41,Person goes for you clearly attentive with what you cruise x your mind before d do any person 00 thousand times war warned does not kill people amoreeee person pomahorca,anger
42,to person you need it really bothers me person I do not work pro my luchita,anger
43,I cry I want eternal holiday YAYAYA,anger
44,They offer for sale or know of person who suddenly has an equal bitch since we promise discretion thanks,anger
45,Last-hour Bulletin Notice to all faceadicles diffunding it with all your friends friends is inviting to catch these acesinos,anger
46,I understand,anger
47,Search godparents for your treatment is not fair that a little angel who lived that horror does not know the love of true human beings,anger
48,Annoying that embarrassant that rabiaaaa,anger
49,she and burst her head to kicks against a fucking curb good morning,anger
50,is person who know who was this beautiful person person that is such person is the picture of person 00000000,anger
51,Right face I have to listen to electronics and all those shits rock what they do now is not rock is pure noise to canada nothing else,anger
52,Belalcazar walked in a Mazda Millenium black please share it with luxury,anger
53,Bus side of this company,anger
54,Seeee nurses united there is no worse trauma q get to service receive you and after all over the turn,anger
55,Person Go for Loz K No Kreian K Andan Me Hackeando My Face No Kiero Hazerme Rezponzable Nothing D Lo L Lez can send or Publikar 0 Wuey C Konekta in My Face Dzd Cotija and 0 D Jiquilpan Ando Enkabronado,anger
56,"or consciousness to more than one as they ask me to sign, we think they go to person",anger
57,Person Peruvian and CTM that is believed to talk about the disaster that happened to us in Valpo put this weona on all the walls and make it shit to the silly WNA with Lissette Fernanda Galvez Garay and Claudio Toro,anger
58,Discrimination today was my son tomorrow can be the one of you to end this,anger
59,Make the challenge and a minor donation,anger
60,Person lost puppies and found in Guadalajara and its surroundings Martha Rescuista GDL Vanessa Durand Yoli D Roa Person Person,anger
61,Person that misera of the bottom was going to steal my niece person please be very careful go around in the park El Vergel on the sides of person,anger
62,Happy international day nurses,anger
63,Kik Boxing Is The Answer Yea not good among the neighbor who is forever right at the entrance of the bikes and the new tenant that is parked in a double place to put his two cars and cover the entrance where the fuck are we going to get with these peopleChinga.,anger
64,dictated in the Auditorium of the Central Bank of Venezuela Headquarters Maracaibo to the spokespersons of the Communal Councils,anger
65,a mazda black millenium please person and give me,anger
66,I can not sleep calm down the pig that did person who was responsible for doing justice at least I hope my family helping others in the earthquake by giving away the Los Arreques Panpranadería and that from behind this bitch is governed stealing the effort and perseverance of a family,anger
67,mercy of you and the tuyosaí person god bless you and you of wisdom for you to person with that matter,anger
68,Executive We wake up this exemplary expresses established references for a greater understanding of the nation's looting mechanism These politicians live from the people and betray the people ... Read it highly recommended ...,anger
69,Please really do it to this photo so that these ruthless reporters and photographers do not make these acts so inumane,anger
70,a fatoua you will have to raise it then do not blame the government the school society friends la friendsnot like a human being,anger
71,impacted that's why we are as we are,anger
72,Baradero complaints book when they are going to solve the problem of street miter at 0000no live on that block but gives anger that year after year everything is still the same there is no solution for nothing,anger
73,Person nor tell me and speak badly,anger
74,Blame the Government The School The Society Los Amigos La Tele Artists The Internet Teachers The Church The Boyfriend The Pastor Noooo The Guilt You Have You For Treating Your Hij As A Puppy And Not Like A Human Being,anger
75,Please send game requests and deleted instantly,anger
76,Chales very true All these are a puppetball moved by the interests of the PRI and person but this can be for gentlemen,anger
77,Care Raja and No K This Sako Wea could not handle more like that with the Chilean Politika Hernan Person JR Person of the former President of the person Hernan Larrain goes through his sanction,anger
78,"Santa Ana because there I go down but too, it's a chantaaa to share porfis",anger
79,They are chingaderas where we are going to stop hasmeelchingofavor,anger
80,I stayed without speech if in case the crisis is like this and if it is privatized we are going to be from the fuck or and people speak nomas x speak,anger
81,it does not exist for this time share this photo I am interested in little if likes person if you share the whole world,anger
82,I want to have a million friends ♫ ♪ ♫ ♪ ♫ ♪ ♫ ♪ ♫ Person,anger
83,HPS That wretch of the bottom was going to steal my niece person please be very careful walk around in the park El Vergel on the sides of person,anger
84,"The affected major area was the north of the isy, it seems that they want esocontra when they learn to keep the whole island equally",anger
85,you and the tuyosaí person god bless you and you of wisdom for you to person with that matter,anger
86,All my support to all coca cola workers especially those of my land that do not sell cocolas to the second around the world as not to be able to keep factories,anger
87,Go to person stop shitting people one has for their efforts and that they come vagos so stole all nodalpm,anger
88,You would do it if it's like that Share it with silvia Trejo,anger
89,Person support this campaign against discrimination today was my son tomorrow may be that of you finish this,anger
90,When I have to return home because of the pickets do not walk the trains nor the collective and one has to be a skill even if it is risking the vicason gajes of the daily office that I am used to me another,anger
91,Person Person Person You Can Dales An Opportunity Also You'll See What Nest Stories Tell You,anger
92,jajajajajaja this photo made me the afternoon hahahaha spa the sarabia only available in season of rain hahaha are all invited as I did not occur before a good business person,anger
93,Before those who should do it encourage you to put the cat with the cat not on social networks hugs and very good night,anger
94,I am like the people's notebook are more expensive than the bulk Q pants,anger
95,Q bad wave q my truck is broken,anger
96,FYI Things Do not get lost Person change from owner I was stolen,anger
97,Person Pal Person Look Primo in his Mare With Adame Huhante,anger
98,Problems Minister Person The Budget of the Police,anger
99,Mechanism for puppets You do not feel the invisible threads tied to the jacket and as good citizens nothing rests us now they are going to start fine by doing sportsDo pussy we are going to get children of p,anger
100,No no parking payment,anger
101,"the people do not use but as long as we do nothing, it will always be the same story I leave the task so they can see where we are wrong",anger
102,The criminals The claim of politics is a thing and the usual exploits for any reason is another thing fed up with the social reality Argentina black sayings let us live calm middle class always hurt,anger
103,was Fueeeeeeeeeeee,anger
104,in the hands of the Masters Justice now with Alexander Santiago and Maritere Santiago Cuevas,anger
105,in case the price of water depended on the area where you live and now it turns out that you are reevaluating the areas we can do as citizens,anger
106,Person Purchase Person Cool Person Bazar of Be Pink Friends can help me spread this woman who is Politic Politics in Veracruz spread that she transpose barreras person and,anger
107,Feels,anger
108,This goes for all those who do not answer me on facebook,anger
109,saying they are the best of the best when the truth is nothing and I guarantee those who give declarations to the person,anger
110,That's when one is good and when you already take a boluda you get away xq you get tired and now you are the worst shit in the world Sona,anger
111,D clear k michael jackson is the king and it is not such justin,anger
112,Atlantists Let's press for Twitter to the League so that the meeting between Monarchs Morelia and Atlas is legal since when belonging the two to TV Aztec Monarchs could allow three points to the Atlas in the fight for the descent,anger
113,Good Old Times New Ones Coming Up Soon When I find these things on my computer I enters me asardor in the stomach,anger
114,Turma Do Bem Insecurity in Argentina I played the door of our friend Maria Delia Toulouse stole all thanks to God she and her children are alive a lot of strength Maria Delia we love you,anger
115,is by health assholes,anger
116,I finish being Person Diego Aventin Confement Carisbajo The duck I hope that this year without the jet and corrupt person change things for good,anger
117,See there are things that are simply too hard to believe,anger
118,A few days in the world stars the best of the weasel Salsa Congress 0000,anger
119,Hiiiii Jesus All Powerful Look Q Cochina Sip can be some girls but HA and OHO DE SHOPPING REE CHUSCA,anger
120,A detail with production makes us caviar dated and we will inform you the day greetings,anger
121,Together with his children against this damn illness you are some champions,anger
122,people and you have the power to do what you want,anger
123,"person k is reading, they earned my friendship and more k that a brother of heart firm day race and I am upset with life pk haqn passed things k no deven of passing and you are life is unfair but person we walk happy day aki d his friendPerson The CAASSH DRAGONN WITH VALERIE",anger
124,Something to say about my digesting on the face,anger
125,"Someone very cruel shot these puppies in front of our house please we need someone to take them to take care of them, we can not",anger
126,... but we act soon they will fuck us and they are those who are going to eliminate all of us ... Independence and Socialist Homeland we will live and we will beat ... HLVS ... and,anger
127,walk with the pure rin my dad saved today shares,anger
128,What ASSE TIME Should Averse Made to Awareness Awareness Already Basta D Television Junk,anger
129,There is a peña that his vocation was wrong would have to have been dedicated to the painting of cute and not the block must be very,anger
130,Yesterday they began to reach Latin American leaders to Havana to participate at 00 00 Person January to the Summit of the Ceac Person person with three days before starting the summit to meet with the murderers of the Cuban town with Association,anger
131,Tough hand for criminals and a fairer justice for all sin is to lie not to believe,anger
132,I see how they work are some shits,anger
133,I need a professional team of psychologists and psychiatrists to understand because there are people misconduated JA ta crazy,anger
134,If we all go down to this I think we would annoy them to electric a lot so because we do not join us it is an hour to disconnect all thanksgers,anger
135,TABLE A SOIT FOR THE CISMOSS KE Now they are already faster Ke the internet jjjj sorry my freen,anger
136,"Now I see why it's santa looks person, saying that they are ternuritas and I waiting for the chubby",anger
137,Dear Lord Is the World Coming to An End I've Seen It all how many know and for the high are the most believed with nicolas martinez and person,anger
138,"I am super angry recently, I find this, who made it ask is to waste time but I inform you that I did not do it totally false",anger
139,Thank you I hope to have you,anger
140,Blame the Government The School Society Los Amigos La Tele The Artists The Internet Teachers The Church The Boyfriend The Pastor Noooo The fault you have you for treating your Hij as a puppy and not like a human being,anger
141,Chicky people who only remain of that,anger
142,Person look how nice a shim in vb walgreens in opening the boxes,anger
143,possible that they allow them to have them in that state there is the proof of how it has its folded leg and at times I did not support it,anger
144,Pinche Government CRES that with your disgusting minimum salary you can pay that cost your system only impoverishes the poor more and more and increases the rich wealth if the cost increases we will make a popular meter not to the price increase,anger
145,Pinches Streets of the Chingada full of bumps A day fuck the Rhine for a fucking Basne Governor and Municipal President I hope your mom passes through those Bachez and is shitting,anger
146,So I'm the Movil 00 by the Stone Rain At The Extrencing Entrance of the Mabasolo Various Blocks Before Fire Luckily NO AY AYE HEDIDOS WITH DESTROCORDO One Firefighters Comodoro,anger
147,Q wena Pigros de Chile Family Face I arrived this letter I say that it is unfair if I need to share it thanks,anger
148,Person Original Person LA PIRA CO ANGA PIRA Cure the Heta Oia Pea Agued Ñanohe,anger
149,For this it will serve the soat banana country every bike that is sold should be safe from not on the bike by 0000 thousand I,anger
150,Novello Alcobendas is open every day! Call us now 000000000,anticipation
151,Registered pharmacist and doctors of our walk away from their jobs from 00 and 00 years old to discover that 0linx could help them be economically independent by three to 0 years please check this date and invite you to be our guest,anticipation
152,plans and affectionate mind notify men so that they are integrated as best suits them 00 immature women will read this and make a grimace,anticipation
153,take it to the veterinarian but person to be able to locate it can call me at 0000000000 please share nanette,anticipation
154,Expanding horizons with Ironperson's sponsorson in Chile,anticipation
155,My Jefes Chineandonos at Academia de Natación San Bernardo,anticipation
156,this weekend advances the carnival for battery euphoria and comparsa beautiful flower with alejandra mansilla and comparsa person sp,anticipation
157,Celebration of Primicias Sunday 00 February 0000 Proverbs 0000 RVR0000 0 Honor Jehovah with your goods and with the first fruits of all your fruits 00 and you will be full of your barns with abundance and your wagards will overflow from Most and 00,anticipation
158,Cordially invited to our united worship Nov 0 Do not miss it It will be an unforgettable experience where the presence of person is to move greatly Invite your friends neighbors Family Everyone is invited southwest district awaits you,anticipation
159,My Mother in Law I Really Love Her And I SO PROUD OF HER LA MAGRIEND YOLANDA MORENO OF CHILD BiOlogaquímica First Exhibitor of the Forum 0000 Performed by the Juvenile Network Sinergia Colón,anticipation
160,I am happy because I'm going to marry the owner of my heart thank you person for person who means,anticipation
161,Manuel Romero.,anticipation
162,Ma Star I hope this Friday by Telemundo,anticipation
163,Person 0 hasi is boys every one sees his dream in his way and mine is alo big,anticipation
164,Football Wednesday we are going to support our selection we are waiting for you not to cover,anticipation
165,Maday cuisine that I can not continue with this income,anticipation
166,000 at National Migration Institute,anticipation
167,PROMOTION OIL MOBIL 00W00 plus filter by 00000 Mobil Special oil Lubrax 00W00 plus filter by 00000 Synthetic lubricant Alignment and Rolling 00000 Scaner 00000 Do not miss you WAKE WITH ISABEL Margarita Bravo Waltemath and 00,anticipation
168,0000 until 0000 you're going to lose it,anticipation
169,Welcome Bellows to the Abe Family We will enjoy all the events of Congress Abec 0000 Together Live Bartenders Viva Bellows Viva LA ABEC,anticipation
170,Happy New Year for all not only ends a year begins a new party party party celebration 00000000 you are ready today at 000 000 Main St Pawtucket RI Ministries New Covenant,anticipation
171,Entry You will repent hahaha Contact by private D,anticipation
172,"0RA ILAPSO Season at the CC Santafe in Bogota, encounters Plaza Colombia Level 0 Together with Crepes Waffles only until 00 of January of 0000",anticipation
173,Sterilizes free sterilization campaign thanks to the people who will very generously make possible the campaign in which they will benefit from 000 Pekes will be for the municipality of Ixtapaluca month of March,anticipation
174,Rheinzaber SIMPOSIUM Germany While taught Basic Dynamic Auto-Valuation Course III Symposium of DR Romero,anticipation
175,And until I arrive on Sunday at times to see my Barcelona play,anticipation
176,This is the programming of the Grand Passacalle in honor of the Virgin of the Candelaria in Lima the Caporal comparsa of the UNMSM will be present again,anticipation
177,Give him together,anticipation
178,true friends where I divorced myself where I discovered myself from Monday I will do what I like the most and what fills me the soul that I can ask for life nothing just give thanks to God and life for everything thatgave a happy year for all,anticipation
179,Person work with talented passionate people and above all humble very grateful and proud of work at today's shooting with person person person and person pending that we come in great person superheroeramerie,anticipation
180,Johnny Depp 0 The realities overwhelm us but the change is in our hands,anticipation
181,with all my friends of person and those who are not yet and someday I will have the pleasure of knowing them all,anticipation
182,D Contest Dale I like and share this photo and you can win a free trimester at our Academy we will raffle the prize when we get to the 0000 Like Dale Let's play together,anticipation
183,Nano Console Smart TV with Android System Lightly easy to operate with very economical built-in camera and C guarantee manufacture,anticipation
184,We continue visiting communities right now on my tour of San Francisco Barquisimeto,anticipation
185,Share and PA,anticipation
186,Wow I already want it,anticipation
187,Lets Support These Groups Cumbia Lives on how much Kieren see these 0 groupings in a single essenario very soon the cumbia returned and person detention of the kumbiambos groups in Dallas and Forth Worth will come and the music and the Cumbia Renacera with Argenis,anticipation
188,Today eating me has given me a look at the weekly XL yesterday and you do not know the illusion that I have been able to do me with one of my published jobs,anticipation
189,In the Temecula Valley Balloon ride the report soon with Paola Sayoko Tokunaga,anticipation
190,Nothing happens by chance Bomione,anticipation
191,Fenix Tattoo Local Anything for a tattoo hehehe I just need an MG and I have free tattis this is this or catching up Silver P voting to the Cretina will not vote at me hahahaha,anticipation
192,I can not see you will remain forever because I have learned from everything that my person has allowed me to live to stand firm so I think and not because I see,anticipation
193,Club Block Shop Good Life Person Ker Barcelona Give him all the pages and enjoy everything we have in Barcelona,anticipation
194,Today on the gay beach of the tonins,anticipation
195,Meanwhile in the market of San Juan de Dios in Guadalajara,anticipation
196,Person admiring blue color like never,anticipation
197,Person something impossible for God of course that I do not encourage and strength for you pile and the whole family only God has control of all things,anticipation
198,Amix that we are going to see the person's papasito see you in the club,anticipation
199,"Do not get confused more than between the confusion and the pestiños of my sara I will take it clear """,anticipation
200,It is better to retire and lose than to lose everything and pray love,anticipation
201,New battle uniform for 0000 golden selection,anticipation
202,The day is like to practice the two blankets the new blanket and the old blanket put on your bed first the new one and then you throw the old one on top,anticipation
203,My champions for there are saying that an image speaks more than a thousand words an applause for this champion,anticipation
204,Person and very happy of my life without stress,anticipation
205,"Look at the results, it's official weight 000 lbs YES YES",anticipation
206,Mmmmmmmmmmmmmm very good morning all,anticipation
207,Person These are the 00 warriors who will represent us in Brazil successes boys,anticipation
208,Radiologue brooch Radiography included,anticipation
209,Person when you whered I take a turn,anticipation
210,Want To Get 0000 in Free Products from Beauticontrol Inbox Me For Details Dont Miss Out Love BC ♥ Want 0000 in FREE Beauticontrol Products for More Information Send a private MSG Do not miss this opportunity,anticipation
211,thanks for sharing the 0000 I wait at 0000,anticipation
212,Do not lose more time and write your greeting to that special little person,anticipation
