,text,emotion
449,Monument of Our Lady of La Paz Diocese of Trujillo Venezuela We must just begin to value it,joy
450,The menu of today Thursday Chicken with Mole Language of res Piernita PCO Chile Filling Bisteck Rancher home in downtown area and surrounding area 0000000000 and 0000000000 Remember that we have lunch to take only 00 pesitos that have excellent day,joy
451,Anti-stress anti-cellulite massage Reductive massage Among others we work manually and with passive gymnastics Electrotherapy Maderotherapy among other information at 00000000000 and this way takes advantage of Ya and Palacate Bella for December,joy
452,Return to your body what you lose with your agitish lifestyle Visit us wwwevelynforevermyflpbizcom ID 000000000000 Evelyns Pictures,joy
453,"Person Ryuko What Are You Doing She Wants Wish You to Merry Christmas ♥ Have a more fun and healthy today and tomorrow, that the Lord bless you with good health you and your family and that you fill them with love ♥ xD 00 He who wantsFeel free to label nwn with",joy
454,Person that happy happens yesterday with my sister of a long time that I have not been together I love you very little sister,joy
455,good friendship and that God is met in all your life foreverperson with immense total health in your Facebook friends all that I wish for tons of all my heart,joy
456,0000 Ire to Oaxaca Huatulko 0000 Suck the Visa and I'll Live Me Person If I Tell Me Person A Gringa 0000 Ire A Cancun After Gathering Money And Work Less Keo And After Oaxaca Person And I'll Be In Karro No Pos TikiTiki.,joy
457,Classified Caleta Olivia Caleta Caleta Olivia Traxion Motorsalumil Caleta Olivia Caleta Buy Neighborhood Rotary Caleta Olivia Caleta Caleta Olivia Josefina Multiespace Martin Gaitan Diario La Morning of San Jorge La Marquee Productions,joy
458,my body day by day Infinite thanks and to continue giving him hard to crush that half Marathon CD MX DeceroAcorrer GISS WR,joy
459,I wrapped him in honeycombs and I'm going on a manger because there was no place for them at the inn full and empty lives,joy
460,I found it great I still remember when we had to do with our family's dog as it was terrified with the firecrackers,joy
461,Siiiiiiiiiiiiiiiiiii at any time despite difficulties we need to believe that this will be because person is doing because it loves you,joy
462,"Hello, how friends we wish you a start of the week full of joy good relationships and excellent attitude we share this message for person reflection",joy
463,Particle see the smile of happiness emanating children,joy
464,I do not delete you God I take it out because I did not build you,joy
465,We are giving it a new image our cede,joy
466,Person yoni person happy day to all my friends that you have a nice diaaa,joy
467,Thank you for k this mearda does not let me EtikaTar all loss k kisieraaa a kiss and hugoooo to toddoosss,joy
468,Limited vacancies,joy
469,the time to be supporting us a thousand congratulations for the 0000,joy
470,Brandain my new Samsung Galaxias Note 0 cell phone,joy
471,Promotion for everyone because your company deserves a good image,joy
472,bora,joy
473,"It has a new toy or used in good condition to the different reception points of our commune tennobs stand out for our good acts, it supports in these campaigns in Teeno Chile",joy
474,"I give thanks to person because of the blessing of life here is the ultra sound of the future baby castañeda person allows him in April0000, my baby will be born",joy
475,That the products are of unique design to sell pins vinchas hair gumped flowers bouche can be sold at home between friends to premises to wholesalers etc.,joy
476,Happy awakening my friends health peace love and blessing of God for all of us and our families a kiss of good diamuaaaa,joy
477,I will marry soon friends I am very happy thank you love person,joy
478,the special moments for person for all those samples of affection that they gave me bb of all person I hope to continue telling person you one more year,joy
479,In Miami this show I do not miss Danny and Person together in Miami,joy
480,thanks to all those who did from 0000 a great year,joy
481,"We are at your disposal, thank you we are waiting for you person visit our faceboock paintballspartan Moreno with paintballspartan Moreno",joy
482,jejejejeje for singles,joy
483,look brother the old spider man who knows where this exhibition is someone knowing where is with delacalle in love,joy
484,Abrido of an excellent little bird,joy
485,Greetings to all my friends on February 00 I will be by the studies of Ecuavisa International Guayaquil Ecuador next to my great friend person of heart Thank you for being aware of your server Jhonny Simbana 000FM NY ECALATINOS RADIO Radio,joy
486,Renewables will be the second source of energy on the planet in 0000,joy
487,"And tomorrow and New Year's Eve, we will have a cotillon at 0 euro for the attendees and it seems that neither rain nor much cold in torrijas spain",joy
488,Person person person my family mom daddy and little brother I love them very much,joy
489,From Colombia,joy
490,God you have as you want in every healthy heart to the sick liberates the captives he pour out your presence changes the consciousness that he sees the blind,joy
491,So I feel for Ete Nuebo Year with God in front of with Rosely Henriquez,joy
492,Love a nice afternoon hehe,joy
493,my nephew enjoying the title,joy
494,Person I want him ber so hahaha,joy
495,Ole that kind more chula the great monitors,joy
496,Person celebrating with the most beautiful cousins hahaha with toño domitz,joy
497,Vacan Alliance Blue Tin Tin Tin Tin Tin to Los Greens I smoke me the red the red the red ones have lice,joy
498,Hours of the day 0 days a week and as soon as I can I will give you an answer thanks,joy
499,"Tomorrow, November 0 is your birthday and I want to be the first to say hello I pray to the Almighty you pray blessings to you and your family and I thank you for rewarding a daughter like you so special that you spend very cute I love you little daughter with rosalia leon",joy
500,We are part of the person of person we are brothers what a great gift person for each of our families and for being your family,joy
501,Communa Montañita The best tourist destination of the country Very happy people missing practically 0 days to end the year,joy
502,Astronomical and navigation coinciding with the Tropic of Capricorn in Latitud 00 Degrees 00 minutes South Good Procedure came the summer,joy
503,The new check at 0000 D,joy
504,I invite you to this great tournament we are going to share sports and rest on this bridge of kings with jp sanin,joy
505,"That corner Meanwhile, how much I offer my heart the reason you have a pillow how dream the illusion will be the owner of the",joy
506,Also after the concert will be the premiere of I like you will be giving away person,joy
507,Lirical show and fireworks show to his term Return to the parish temple and blessing with the Santisimo Sacramento,joy
508,They want to impose do not exist until November 2 in Plaza Islands Malvinas,joy
509,Person who is aimed at seeing me a while lolita lounge bar madrid c manuel de fala n ° 0 stuck to person more info 000000000 whatsapp,joy
510,0000 Tables 0000 Mistral ICE 0000 Distillates from 0000 National Bar International Bar Best Safety The Best Environment Deco,joy
511,it can not solve because it has been the same one that has created it for this must have a realization without interference of thought without condemnation or justification just a realization,joy
512,WorldCup Person person as we said because America is for Americans you have to continue supporting Argentina ☀️,joy
513,Mmm I want them ♥♥,joy
514,Superclass Hello good morning to all of you,joy
515,A good bath and the bed that is good and a good resada so that the Flako de Jerusalen does not punish me for all those shit the last ones so that 0000 is different from this if I lack SIPO,joy
516,Girls mascara miracle ball show look striking mask for lashes lash love marykay excited enchanted,joy
517,This new year is full of many successful joys that your expectations are fully culminated in every sense that God bless each of you including each of your worthy family that prosperity and said reign in all of you my friends happy year0000.,joy
518,life with all the sincerity and whole heart I want a wonderful day that God bless you Hoymañana and always be a lot,joy
519,Person the new union discotheque,joy
520,Good morning friends we are waiting for you tonight again in,joy
521,Great Chocolate will take place the day 000000 in Human Settlement,joy
522,Preparing me for the night photographic session of the 0O anniversary of I Love Cosplay,joy
523,To the American Red Cross maybe it helps someone who needs it,joy
524,"Merry Christmas to Tots and Prospero New Year, all our dreams are aged and come loading of gifts special to all my people and xsuposed to mu family and komo not ami great treasure person a new year and with you person my love with javi",joy
525,Free Basic personalized advice included,joy
526,Then signing papers to receive my cute stroller a good gift I share with you as the song says I do not forget the old year because I leave very good things,joy
527,This Saturday we are all in the Goollla culminar Nuevae will start the month of December with all,joy
528,We are already ready for the first night endurance Socavón 0000 Scoralles of Socavon Socavon,joy
529,Caguamon Two XX Mamalon at Brewery Agency Rangel Frias,joy
530,Look friend vianey pa that you remember you all a barbie,joy
531,My Little Cousin Made Me A Wedding Dress Last Night ❤️ Its Perfect Change of crown and at least we have two crowns,joy
532,"""In the end everything will go well and if it has not come out well, it's still not the end""",joy
533,Animal Center San Juan,joy
534,Miracles and there is nothing impossible for the Gracias Lord because not only was the calculation but the cysts also disappeared after praying for 0 years you promised in an assembly in Quito that I would be heals and now I can witness that this was glory to God,joy
535,Free entry cucoteatro trovasur friends from otavalo I hope you enjoy and laugh at one of one of the best showsque we have created,joy
536,The forgiveness is what restresses the heart Congratulations Merry Christmas for all who have a beautiful Christmas Eve full of joys and happiness congratulations,joy
537,Induction room,joy
538,Advance limited to 00 euros with 0 consumptions Entrance in Puerta 00 Euros 0 Limited consumptions No tail Measure taboleado at the end of the year,joy
539,It is human lives life so that you do not let life live ► ☺ ►,joy
540,won the caracas0 x 0 to the sharks of the guiraaaaaaaaaaaa,joy
541,Potential We are like 0 million quinient thousand and not only 00 thousand of Jotabeche conclusions must be performed next Tideum at the National Stadium Open for all the Evangelic People Shalom in Santiago Chile,joy
542,I wish you a very good rest that the great God takes care of them and seeing your rest you want a great abrasus from my cute chilatedios is faithful and it is true,joy
543,Person walked in the center pass through where the Nice hotel was and surprise that I am one of the person with what the hotel built,joy
544,The perfect duo without Commercial radio,joy
545,hahahahaha that they thought that I was not going to publish how much they sleep looseness and I congratulate the girls that if they get up early congratulations isa and raquelita,joy
546,Lighter but only those who know how to love and love will know how to understand,joy
547,Chela with snack at 00 pesos until 0000 hours alone in,joy
548,"This is friends, put the batteries",joy
549,"please never lose faith and hope, and if you are already happy, share what you have with others person",joy
550,When I need them that I laugh together when I am happy and cry in my moments of sorrows I love the new year for everyone who arrives loaded with blessings and a lot of health,joy
551,So k men make their mommy look good and always treat a woman like princesses as he does,joy
552,"This is how it was today Linares raining a lot and few people through the streets I will be in its Christmas market until January 0, a hug to all visitors and friends",joy
553,Children's Maternal Health Center of Rimac Vaccination Practices Hepatitis B Influenza H0n0 Students Archbishop,joy
554,Person very good morning person bless you good sabadito,joy
555,Good this if it is the mere truth,joy
556,Mature transvestites of df my nnes and nnas the challenge to play the puzzle of neashtravestiscom like and share,joy
557,A TRUE FRIEND I appreciate the friend who has me on his agenda to remind me but I estimate much more that friend who does not need a notebook to not forget me,joy
558,The man is worthy of his salary,joy
559,Nice weekend of health and blessing after success at the Korakuen Hall and congratulating my CMLL colleagues for its great performance delivery and the main success in its tour in Japan congratulations are a hug ❤️❤️❤️❤️,joy
560,"Exactly fucking eyeletball if they talk behind my back is because as it is customary, I am very ahead of them",joy
561,X End and known the Queen Dairy jajjaj every day I like more the North with Arantzazu Perrino at in the Wet Neighborhood of Leon Tomandola de Vinos,joy
562,So or more beautiful hahaha and I do not care if you ablan amis back damn vibes ja,joy
563,Hello Duenas Nights Have a Sunday Sunday,joy
564,In the time of Cole de Joda hahaha juaz juacien person person person,joy
565,Viole Holiiiiiiiiiii,joy
566,Person this year more and better,joy
567,"For all of you Facebook that has been an important part and forever supporting my musiques, the Bendigay remember in this day especially you have to share something with which you do not have alludoshaaaay",joy
568,Make yourself worth and do not allow others to callen you that you have a magnificent Friday,joy
569,"On behalf of our Lions Club of Cagua we wish you a very Merry Christmas, enjoying with your loved ones and rejoicing in happiness around the birth of the child God",joy
570,Start December The first Sunday Day 0 of Diciembrese lives in Guggen Toca Enjoy with a clientele and a luxury environment with the best music and renovated airs This is our day Come and enjoy the best Sunday Pásatelo Guggen with almost,joy
571,"Person I would like to know where my fans live, comment on their city and I am from Seattle Person Lombardo",joy
572,Angel Insurgentes sur 0000 Col Guadalupe Inn MB France We do not have branches with omar rodríguez rivers and charly lopez,joy
573,My beautiful reality and I do not change it for nothing with juan carlos brunette peres,joy
574,With these words as certain and sincere as I am I say goodbye to my false marriage life that I have taken for 0 long grassy years to my god by person person,joy
575,we for you to do a satisfactory negotiation that all have a successful day Sunday,joy
576,"that friendship is the biggest thing in the world does not buy it is not sold, you win with the heart the truth and the valuation of the soul",joy
577,Mmmm delicious love as always with nancy grandson,joy
578,In this we know what the love is in which Person gave his life for us so we must deliver life for our brothers hello my brothers sisters and friends remember that it is just a step of life to death person,joy
579,loyal servants when they participate in that future global educational work in fact he and his son have been with the faithful over the centuries before ascending to heaven person assured his disciples that he would be with them,joy
580,K take kon migooo,joy
581,Today four years ago you came to shelter my winter to color my life with each garrupatohe illuminates everything that you touch are my light the loan most satisfying and paid with more I love you person you are my light my future doctor,joy
582,Person good friends yamigas felis night because this child is ready to go to the pachagon thank you goodbye all very nice I'm very felis,joy
583,run and not run to suffer,joy
584,God bless you that you think a little bit of humor until tomorrow with the help of God0 with sweet candela and jaime arment,joy
585,There is no doubt that for these cold this can be the best solution the grannies are passed with the manual embroidery hahahahaha,joy
586,Preferred for the most delicate Veni visit me veni go and come buy me jajj,joy
587,K such gelatin k I did to my fat,joy
588,"If you drink, it's alcohol not guies ok",joy
589,The faces they put when they say there is examination,joy
590,therefore loving others also if you want to be in harmony with everything that surrounds you first must be in harmony with everything that makes up 0 coherence and affection in person,joy
591,The changes are physically distance from those who estimates but not the heart that feeling will always be there no matter where they go,joy
592,Mmmmmm All the dance and folklore of Tarija present in the Dakar 0000 forward Ballet Latin Blood de Tarija Bolivia,joy
593,hello very good morning as they woke up I hope person all very well because person I leave this detail nomas to tell them k have a wonderful day and k god melos person today and always aki person his friend person k have a beautiful day,joy
594,DECEOS MY THREE DECES WERE WILL DIE AND RETURN THREE TIMES AND HAVE YOU WITH ME TO PERSON OF WHAT I LOVE YOU MY LOVE MY CHARRITA BEAUTIFUL I LOVE YOU HORRISHBY JAROCHITO HERNANDEZ000 LIBRA 00000 0chaparrita Love Jarcho With Clear,joy
595,Thanks for the support of always friends,joy
596,Person f person jose josé fernández person good here have the photo what promised is debt though I have not promised anything jjajajajaj,joy
597,T I Love Vanelys 0 Years ago you came to my life and it seems that it was yesterday when I saw x first time I love vanelys yobel q you fulfill many years more my little princess Hermocha god spill blessings on you daughter,joy
598,Enfimmmm married 00000000 person,joy
599,All people who share the link and put MG to Bakery and Pizzeria Person are participating by the raffle of a family pizza a drink of 00 that will be done every day Saturday Play,joy
600,Person my beautiful friends who have a splendid day my beautiful friends and what they are not too with it toojajajajja,joy
601,Happy 0 months my reynaya 0 I can not believe how it happens time with day that happens you give me a huge happiness xq always something new learned x fill my life d happinessMami t amamuchooob,joy
602,PERSON  PERSON,joy
603,Spend your energy flows gently with love life is divine energy tuningatey Be happy person images,joy
604,Family reunion children 0 grandchildren 00 great-grandchildren 00 more who are born this is a great offspring with anayeli,joy
605,"Actually grateful with acceptance we continue to grow without stopping day by day today, other new units are confirmed, we will not defraud our people first in this new Erala was from Santo Domingo de Guzman",joy
606,Here is a photo of the Niagara Falls that now if you can cross on bicycles q Friiiiiiiio New York and Saturday Snow again or cry or you laugh I decided the last ha ha ji ji ji je je je,joy
607,Have a beautiful and blessed day,joy
608,Person to die hahahaha,joy
609,Cute k were that day in stream with my family,joy
610,Person and person after years away I give thanks to God to re-know D USTDS my great friends,joy
611,The good end I arrive at Photosuper Fuji takes advantage of the great discounts we have for you,joy
612,Excellent and wonderful morning God fill them with blessings,joy
613,Bachelor and that contribute to Education in Values of Future Professionals of Law,joy
614,It will be forever winner for that father guides our steps today in this morning and always where would we go without you,joy
615,Make a little more than 00 years with Marisa Fretes Dos Santos and Valeria Ramirez,joy
616,yupss read btl0,joy
617,My Matthew growing,joy
618,Take while KSM.,joy
619,It is not always the spell checker,joy
620,"I like jajajajaja there are little boy, the landing started",joy
621,Today is the birthday of my love love and 00 my birthday of gave us we are committed to I love you fat,joy
622,Billboard that can accompany us on this great anniversary to celebrate the best with UDSGracias for your comments will be a great help atte Rolandiaz,joy
623,Today there is a living life every moment every detail marks the difference of how we want our future depends on oneself asii that to give him remembering that of the mistakes is where you learn best good day with erick donovan monroy cruz,joy
624,Good evening at all recovery Monday,joy
625,Service,joy
626,Person I am a woman committed to person for seven years and is the best thing that has happened to me in the vice and my commitment is until he comes with a person of person and person,joy
627,The security team with our pastors celebrating Christmas,joy
628,For Sale Suburban 00 000 Mexican Standard 0 Cilindroscon SUPER ECONOMIC GAS SYSTEM For more information Communicate to the cell phone number 0000000000 with operator Paulo Servin at a good price with Maribel Martinez Almanza and,joy
629,Yes of Course Person Photos from cel,joy
630,Asiets is positive amen,joy
631,it's something that megusta 0,joy
632,As an engineer apart from being married to me jijijiji that better way to boost our children so that they are well and above all people to prepare only this is achieved with the example many congratulations,joy
633,the clutter was formed up half jodaaa,joy
634,"Saturday 0 and Sunday, June 2 00ma Feast of San Antonio de Padua Bachateros del West",joy
635,My person during this year 0000Abrazos and kisses at a distance from Peru 0,joy
636,Would like to read it in all the walls even if it is 0 hour,joy
637,We are going to start the day with a smile in Bernal Argentina,joy
638,Visiting Sasha Person,joy
639,CERTIVES TO MY FRIENDS PEST Clínica Davila Enac Posta Central and especially to the Tens Arsenaleras who celebrate us when they are anti-seasoned work the one that we played proud of servephaliz day companions at my home,joy
640,Lets Party how many are aimed,joy
641,It's the mere truth ok,joy
642,Person so I received upPackaging delivered at Central Park Hotel La Habana,joy
643,Good night amis and familyq my brunette covers them under their mantle,joy
644,"With a super positive attitude, God always gives me evidence that he is with me",joy
645,Thanks to papa god spend a super fun day and I hope that you have had a good time hello to tods a blessings,joy
646,Balanced for the dogs of the shots and those who need it most about the price is from 00 Sumateee with Naty PS and Alejandra Carballo,joy
647,The newest of 000,joy
648,I love you happy birthday my love that you enjoy it muuuuchobienvented to the technology smartphone with esteban person,joy
649,HERVIDERIESZORRITOS CITY TOURS SQUARTA DE ARMALECON 0000 BOULEVARES Paseo La Concordía Paseo Jerusalen and Other Shopping on the Green Water Frontier and a lot of numbers Forget Taking its coconut water Eat black shells and bathe in the river Tumbesle Aguro who stays in Tumbes,joy
650,Eating ripequisimo.,joy
651,Question of autoanalysis to know who you are and what we want,joy
652,Hoops and many more I wait for you,joy
653,Lose this great event,joy
654,Person start of the week my working people God bless you always,joy
655,Mendoza where King David was born,joy
656,"Jejjepues was not already lucky to be a few 00 years ago in the original version tomorrow, my person will be heard in part at SuecacecerCita de Valencia in a concert that I would recommend by Valencian with mogollion of musicians and with several musicals fantastic",joy
657,Wake up and tell you mom I want to dress up princess today does not have a personal price,joy
658,Driving and transit as well as the other Person and Police willing to support mobility of the municipality,joy
659,Church where the truth is preached and have the 0 ministries,joy
660,Clear k sison my adoration adrian person person and my person 0,joy
661,Happy and blessed late hugs and kisses for my beautiful people,joy
662,This message is aimed at tods those racist people,joy
663,conviction that the goal still without reaching it to glimpse is there and only I will decide when I will feel it achieved only for today life is a present in both directions a gift and a here and now maui in,joy
664,These blessings always,joy
665,Person Corree Qe will arrive late at Jale I consider so much about you FRIEND PERSON JAJAJAJAJAJAJJA when you came to the owls p,joy
666,Life is Beatitud Savor Ital 0 Life is a dream Do it a reality 0 Life is happiness Mervia I Quierooooo ☆ 0 • 0 ☆ Silvia Sosa,joy
667,"Well, with this cold half a glass of warm milk freshly milked good night like",joy
668,We participate in the Chiguayante Night Marathon 00 0000 we comply with the goal next to my son,joy
669,Understand that is what happens to us when we feel love for a person our mind is literally filled with a feeling as if they were butterflies that tickle into all over the body but it is a pity for people we do not feel lucky,joy
670,Subcampeon The Great America,joy
671,For all contacts of Mercantil Teno in Teno Maule Chile,joy
672,Person who has sweet person and that person and virgin bless you atodies homie00,joy
673,My effort Rocker debuting in Baru Urbano Miami,joy
674,Very true dead flies are the worst confirmed person,joy
675,Person person is what I'm going to put all summer,joy
676,ONLY DECARGA THIS LINK Installe and Ready Aliomarficial Twitter Person Official Person Fans Club Person The singer loving you by far ali omar,joy
677,Aqi we followed in Mexicali but comfortable the four,joy
678,Hahaha so I'm yooo if you like it right and if you know what you have to do jjajaj,joy
679,so it is not one more to contribute this bad causey you know!,joy
680,0 Club SPORT SPORT SUPER PROUD OF MY TEAM ONLY GOCAS,joy
681,Person today is a great day,joy
