,text,emotion
682,Happiness depends on each one of us we give a great smile to life that person is free jejee nobody can stop us,joy
683,That in many neighborhoods of Buenos Aires we are not light from 0000 hrs and heat recagidates,joy
684,I always have it very present and with Silvana Molina,joy
685,Venezuela Among other countries MASSESPO,joy
686,Receive many blessings this year 0000 a larger than this watermelon I believe it and I receive it,joy
687,Person standing gentlemen today plays his magestad the cyclone of working neighborhood in trelew,joy
688,Person with my mom and my girls,joy
689,these votes have person depends on you who wins,joy
690,Workers are hired years ago as monotributists without stability or labor rights,joy
691,For all and many were missing to label congratulations and blessings in their homes,joy
692,Grupo SisproCom made the delivery of a motorcycle MD Cuervo financed to Mr. Alexander Delgado and you that you expect to apply for your funded bike 00000000000 Photos Deliveries,joy
693,It is not on the waterfront or in Tapiracuai is in Carajaoi proud to be Guajaviense Decime Greate,joy
694,"The day was reached, this is going to put person all",joy
695,February 0000 only for love with friends with friends today not racism or the distinction of person we all have feelings a life of their own so that we live with measures but with equal rights good day,joy
696,Christmas in Fornijaja.,joy
697,all this Christmas I love you very much and thank you for being part of my life I love them a lot,joy
698,H i j or s I loved seeing them and above all Liz so much time and match it was a wonderful gift I just miss person but you taguean because for her the message is also going,joy
699,that I think and just live every day as if it were the last one that happy new year and that everything they propose fulfilled and exactly only live life and be happy that within our many purposes be better person,joy
700,YVE ROCHER Training All A Success More than 000 Assistants I Love My Business 0 Start Your Own Business Register and Get Excellent Gains,joy
701,Ending the Easter tree with the super idea of person hahahahahaha,joy
702,Training School Next Saturday 00 January of 0000 000 AM 000 PM RES SRA Carmen Oliveras Alicea Do not Faults It will be a day of a lot of learning and emotions,joy
703,In the name of God I will reach the goal it is because of those who have cancer God bless,joy
704,Ummmmmmmmmmmmmmmmm with my jeic on woman's day,joy
705,Person I want to thank them for all the tenists who asked person I am super but super happy are 00 people who asked themselves to be cdcs with the admii dolphi we are super happy,joy
706,I feel better time to recover the lost time jijijiji,joy
707,Intimate and intimate this Friday arrives at his nigth club consent person with his best imitations of person and person do not miss it,joy
708,Tuesday of Alas Pide them in La Cantina Fiesta Mexicana at 0 x0 Accompany them with a beer jar by 0000 to consent to how you should be blvd tomas fernandez 0000 phone 000 00 00,joy
709,Yls yo shine where your loved frost is more abode,joy
710,Person Sergio Moon of Alcantara Person Jimenez Person Lopez so if you can,joy
711,Ay so simple,joy
712,Hahahaha so they know that for me there are not ok it's like the shit of a dog pulls in the middle of the caretaker,joy
713,They are so asdfghjk pity that Midnight Memories was the last teenage video MG,joy
714,So it is God has in his hands my tomorrow thank you x the life of each of my friends bless their lives,joy
715,TSS The Posada My Serves Christmas and then New Year,joy
716,Vallecas or request your proforma to the following email greetings friends,joy
717,Person followed together at 0mo now if vacationeeeees,joy
718,• Chikas AA remind you of the last casting tomorrow here in Dúo Agency • Data Volcano Popocatepetl No 0000 0 between Av Patria and Volcano Etna in the urban colli tels ° 00000000 ° 00000000 with alex,joy
719,Have a good time with us and enjoy a magnificent dinner book your table on 000 000 000 and do not stay without it we wait for you restaurant,joy
720,Thank you the company,joy
721,Happy birthday you keep you and take care of you day a day grcias sir for this beautiful blessing you kiero a lot mommy kisses of ale and mine passala cute,joy
722,It's coming I've invited them to the second zumbaton in marine space This 00 August We will have giant LED display Heating pavilion Contests The best instructors Stand of healthy food and much more at,joy
723,Welcome to my world hello people I wish you happy Christmas late but here I am I want them a good fans are the best of this page successes and blessings of their favorite djs hehe jandrowellve,joy
724,I want it friends,joy
725,Institute of Public Administration of the State of Puebla wishes you a wonderful Thursday below the phrase of the day at Institute for Public Administration of the State of Puebla,joy
726,Share Raffle Friday 000000 does not include Rolled Catres or Person Practicunas,joy
727,The second batch of 000 anticipated anticipated for sale in Radio Chart you have to be part of the best party of the year,joy
728,You come profits,joy
729,Latest VIP info 000000000,joy
730,0 as tuuuuuuu ardidacom you do not know how to accept the happiness of us q hurtaaaaa dasssss p,joy
731,Person already passed 00 years old I love you with sabrina person,joy
732,Alfajorcake One of our deliveries today,joy
733,Excelente Sabado to Todos Saludos Y Buen Dia Excellent Saturday all good day Great Day to All,joy
734,Information You can communicate at 0000000000 person 0000 0000 or 0000 We are waiting for you person 0000000000 EXT 0000 0000,joy
735,Person receiving their diplomas for the best student and for highlighting in music thanks little daughter for giving me so many satisfactions I love you my person and we go for a long time MASSSS,joy
736,At Posada de la Zona 00 Preschool with Master Person and Master Person,joy
737,"By ke nothing more see my wall and my profile xq do not send me a friend request I do not know or I'm as a culo, they know me, they will not let me lie there will always be some message ok do not wait for me I send them so easy is that they look for me",joy
738,"On the day of your anniversary Eze you will always be present in our hearts I love you very much your mom is where she is from the beyond, she does not always forget you",joy
739,Thank you for having been part of 0000 I hope you continue to be part of my life at that 0000 heart wish that have a great time happy new year and that this new year comes full of rich and abundant blessings for their lives lkmm with celena lopez and 0,joy
740,put a smile on your face ★ Izze Diaazz Brayan GPE Gonzalez Contreras Person Moon◕‿◕,joy
741,"we all have good moments and bad moments ""ok gentite mind positive and pa lante that life is a single one there is to live it and att a forever person and",joy
742,Party The Streamfest Femmals Femmals Returning Winning 0 Premiosmejor Evolution Better Corporate Image Best Photo and Companion More Solidarity Thank you very much Capullos 0,joy
743,Important that many do not know the love of the family to life and our very happy hijs 0000 0,joy
744,I present my beautiful nephew,joy
745,Of Family Friendly in Perol,joy
746,My new love,joy
747,I'm going to dine livianito and sleep,joy
748,IF Cellular Phones existed Selfie Time Laughing Time Nazarene Humor What would happen if cell phones had existed at the exit of Egypt Reallo is Kosher,joy
749,Navy Base Base Base Oval Base Close up of magnet and metal handles attached to bag with washer to have a good finish detail of metal heart soon I will say prices with piece of cloth,joy
750,LiveLoveshare Ganolife Products Hi Cordyceps 000 Ganoderma 000 immunolife 000 perfect covination you want to acquire you support you a mute of problems in cuention health,joy
751,Christmas if the saves please want to share with all of us,joy
752,Ask for our special birthday packages and bachelorette party,joy
753,La Nabe D Toreto with Jose Abeldaño,joy
754,Person like that better um mm well I eat my yenni at and,joy
755,BB and then he is missing your BB award and look at ORA already knows how to move Lacompu Biendo his movie D Los Minios,joy
756,I was a great start to have a great start to enjoy the last day of the Bridge Oki Los Kiero Race,joy
757,Best Player of the Year Person Greetings Amigooooo Let's come away from D,joy
758,NICE This are the auditoriums when I give a conferences all love science,joy
759,And let yourself be loved,joy
760,See my mother in the hot springs when she had never gotten into a pool is priceless,joy
761,Person Aguevo my beautiful lion GTO as you none just like the best team in the world SISISI ODIEN ME IS VALA JAJAJA TOT THE PICHE LEÓNIDAS,joy
762,Person tomorrow I will have many things to share,joy
763,Person my paul with his son,joy
764,Sear without person amiga person,joy
765,I in this month of love the hairdresser who is fashionable person who is her contact 000000000000000000,joy
766,for the invitation,joy
767,Equipment An achievement More in my Cultural Promoter career with Andres Diaz,joy
768,For my great friends friends person mayra person,joy
769,That's a lot of truth are the complement of my life every smile of them is a sugar to my life,joy
770,Jajjajajajaj q bacan solved,joy
771,Like  PATROCINADOR DE LOS MEJORES EVENTOS VIRUS Infecting Yours Senses Of Sound with Jose DE Luna and PERSON,joy
772,JavieraPrezaperson Person Gooriginal Leave your comments,joy
773,How nice when these things happen in quilmes,joy
774,I already have armed the tray of seedlings with everything raised to buy milk for the collection of 0 liter of milk x month san luis,joy
775,Or the first 0 continue commenting and sharing until filling the collage,joy
776,"Thanks to person, our friend Person was able to open the way through the Esteros del Iberá",joy
777,Happy New Year 0000 for all and all friends friends and friends who wish me the evil this new year I will throw aside what does not serve God bless me,joy
778,And today he wins siiii gentlemen informed the stadium,joy
779,"As time passes to think that you are already a beautiful little man, we love you with madness your happy dads fulfilled my love pass it re super cute cute little thing of mommy but the same you will always be the baby of mommy I love you very much person this is a car but not",joy
780,And if hahahahaha where is this barcelona,joy
781,Person in Chacabuco - Saturday 0 February Show Musical Humor Dancing Dance in Golf Club Chacabuco - Organiza What's Pumpkin 0000 Marcelo Millan Book your Card,joy
782,True about the holidays,joy
783,paste,joy
784,"Do you know what this tree is called the food of the gods, giving it",joy
785,From here I want to congratulate one of the models you posed for me,joy
786,Person good news people the abandoned puppies have a mother nurse a dog that stopped breastfeeding his babies 0 days ago and accepted them without any problem there is so much to learn ♥♥♥ here goes the sweetest image of the day happy Friday,joy
787,So it is better the point com k the point D,joy
788,PZ Aki Only Regandome Jeje With Ivan Lobaco,joy
789,Another more victory about Bosta Juniors that will be done,joy
790,The rebates arrive at Woman 00 Choose your beauty pack at the best price with Rosario Gil Cortes,joy
791,Allanmolina God bless you blessings to Tods Isa 0000 No weapon forged against you will prosper and condemn all tongue that gets up against you in trial This is the heritage of Jehovah's servants and his salvation will come Jehovah with,joy
792,My Bebote Step at 0º to year with very good congratulations Son to enjoy the holidays,joy
793,I love you I love you mommy,joy
794,Recipe for slimming,joy
795,♪ Person that I can not stand one more day without you yourself to person 0 person ♫ person ♥,joy
796,Recording drums  PERSON,joy
797,Very good morning everyone who has an excellent Saturday I love them Munchooo rain of kisses and blessings 0,joy
798,0 0 0 Good morning princewears and princesses Excellent day I arrived the coffeeeee totocctoc jjajajajajajaaj,joy
799,Person of these centers to welcome this way to be like this with IES Antón Losada Dieguez and IES Numeroun,joy
800,With all the power our first week here are our motivated schedules,joy
801,Appreciate what you have now row never think,joy
802,And he knows person,joy
803,Person until they exhaust the capacity of the room we are waiting for you,joy
804,Classification of waste,joy
805,We go with the saints in the semifinals to win them if you can and to respect the,joy
806,PZ To all my Facebook friends I could not tag everyone but I wish you a good year and the best of heart,joy
807,Good day for tods happy we wake up so we can say one day at the same time my person is what I ask d tiayudame today I want to live a day to the vezayer and I pass my crymason,joy
808,Tarija unstoppable the best and most beautiful of our beautiful Tarija,joy
809,Do not complicate this year looking for Local Food Chair Rentals and Mesashaz from your employee party something different this year and choose any hotel in the country and we take care of everything I call us and 00000000000000000000,joy
810,Mission fulfilled GYM teachers for the previous phases of the Spanish Championship Dani 0o and Person 0A Balearicos see you on Monday,joy
811,"CGP Gymnastic Center Paysandu In February, acro classes in fabrics Tuesday and Thursday of 0000 to 0000",joy
812,God Bless You Blessings Sabroza Pina Pink,joy
813,"Person if you want precious only you put me happy if I'm upset, I love you precious",joy
814,Good morning Katia Hilario greets you on this wonderful Thursday and welcomes you to the number one of Todotrujillo,joy
815,TRUE LOVE YOU 0 Think of you,joy
816,Person without despair boredom or fatigue but if with a smile,joy
817,Couple of home energy and we have the possibility of talking to our Mother Earth and praying to build harmony to build peace is the task that women have this is the time in which these tasks begin to emerge ... person,joy
818,They want to live the greatest emotions allowed them so many triumphs to get true Olympia so many stars conquers for me today I promise to follow always with all the soul and with my Garage Guarani go to the Chorus Ramonbral00 with Matilde,joy
819,High Toucado for OCT 0 Available also by TICKETEK SYSTEM WITH ELBIO SEGOVIA BASS AND 00,joy
820,The three honor's three honor Blue School Although you do not believe it,joy
821,Person and that my eyes shine freely I am free,joy
822,Beauty does not last forever but a beautiful personality,joy
823,Trust in the time of God and wait in his promises he waits for his answer to be happy in his miracles in his kindness rests in his presence this is attitude that will take you to success and you will see miracles I bless you with rosita rodriguez,joy
824,In the best CAACUPE SPA Route 00 La Pase Super with my Amongyuliza Gonzalez,joy
825,Hyaluronic low molecular weight with moisturizing and lubricant properties plus ginger and curcuma oil making it one of the most powerful nutritional supplements for joints and skin hydration join us wwwevelynforevermyflpbizcom ID 000000000000,joy
826,Having lunch with my girls before my trip to Sullana Piura,joy
827,From his national anthem as simple labored conquered prestige estimated and honor among so many millions of Brazilians and the entire world Sports periodist and driver of spicy football and chronometer at ESPN,joy
828,Person knows the power of vegetable mothers' cells for the preservation of collagen in our skin! Offlame only from the 00 from the aging of the skin can be treated and the best without scalpel and 00,joy
829,Mmm women are much more dangerous than you have small hahaha or not miriam torres Vero parragajajaja ♥ ♡ ♥ ♡ ♥ ♡ ♥ ♡,joy
830,I congratulate the chickened chickens x the triumph of today well Riber for K See K I'm not a disappointment of shit but I love my mouth of my loves the bank in the good and bad fuck,joy
831,CAMPEON BARCELONA MY FAMILY My nephew Person Child hahahaha,joy
832,"and once you started the game we skipped the test game then we click on game, click Check Purchase Ke is on the right side of the screen at the bottom and ready we already have FIFA 00 full",joy
833,in my graduation,joy
834,Here by premieving the new Lip Gloss Artistry to show the smile Glister special price in December,joy
835,"Every morning, Mr. Sol, I give thanks for another day more day",joy
836,Facial Masofilaxia for this week,joy
837,I tell you the patadotes were for something is a male,joy
838,Person the shabab mtl 0keytna xD,joy
839,the love of my life that is always that I need it that never leaves me alone that is always aware of his family I want to tell him that person and I hope to go by the rest of my life,joy
840,Good day I have great news I will be a tia again and I am happy person and a certain joaquin baez,joy
841,of health x many more years,joy
842,AWWWW SO CUTE LARISSA SANCHEZ ALL IN THIS LIFE HAS SOLUTION I LOVE,joy
843,From Artesanias Nicaragenses you send them the shipment of this Nicaraguan Queque made very especially for you but Santa came and already started to store that Barbaro this Santa was not ironing that Diaverga,joy
844,I sell myself for a sachet of love two sachets of cariñods understanding tacitos kisses and a life of kisses with sweetness who buys me jjjjjjjjjjjjj,joy
845,Person eye friends take the precautions of the case hahahaha at step canoas southern border panama,joy
846,Despite all circumstance I choose to praise God Despite of Any Circumstances I Choose to Praise You God A Pesar of Curcular Curcunstancia Elijo Alabo Dios,joy
847,Here is Mido,joy
848,Playboy The Village Key,joy
849,Good morning to all the people who walk by Ahique such a Friognians to God for the new day ready to start Semanita Positive Cortamuy and happy almost ready for nahosque have an excellent Monday,joy
850,Person today a great little person has already left high school is something capricious but I love her a lot,joy
851,Q have a Merry Christmas GGG,joy
852,"Thank you, Papa God Thank you dear Family Facebook Les Amolo Best of the World Thank you for your friendship Good evening we'll see you in the new Añobay 0000Gracias0 0 0 0 0",joy
853,Using how to do so today many blessings my cute little love,joy
854,Add Peterson Pepe Instagram pepebrasil00,joy
855,Weekend begins the prerise in Déjà vu Are you prepared hahaha welcome BR0 Preventive orders at 0000000000000 or in the bio,joy
856,The ancient kings already used a senior pastry who was in charge of preparing the cake that is as it is called in Europe what is known for us with the name of cake,joy
857,Traveling to my dear city La Colmena Paraguay after a few months anxious to arrive to see them Amis Families Nancy Bareiro,joy
858,they are well blessed and merciful you can be little god for allowing me so many blessings together I feel happy,joy
859,Person stay short,joy
860,Greetings ✌️ we want you to have an excellent week we invite you this Friday 00 from Dec and every Friday to seafood Coral beach 0 PM Riquisima Luxury Food and Band Colonel 000 W Chapman Ave Placentia CA 00000 With Daniel Calderon,joy
861,"Al lio..  NEWYORKIN@S, EL GRAN DIA A LLEGADO...!!!¡¡¡ QUE NO TE LO CUENTEN MAÑANA!!! RECOMENDACIÓN PARA HOY: GAFAS DE SOL,ROPA FRESCA Y ALEGRIA EN EL CUERPO, YA QUE SERA UN DIA DE ALTAS TEMPERATURAS Y MUCHISIMO SOL....AHORA OS VEO A TODOS....BESOS ...",joy
862,mmmm sip how much truth,joy
863,Thank you for Darme Esperanfe and the most important Valentia with Felicia Cabrera and Alicia Cabrera Ramirez,joy
864,Happy Tuesday to all my friends who cute is December Yuppy Yuppy,joy
865,women and blessed is the personal fruit your belly person person of person pray for us sinners now and at the time of our death amen have your request please do not break this ninth but do not resend it copy and glue it in a new message all the faith ofWorld - SE.,joy
866,This Christmas I hope that the Christmas spirit gives you joy to your life,joy
867,Person 0 a special and beautiful day that is very fruitful for all we love you very much,joy
868,This m will send you person,joy
869,My life today I can scream invicto champion you are giant my beloved club person thanks to the players that wet the shirt day by day,joy
870,Grasias,joy
871,Today is Friday person Person I am more for bed than to person and I look like an old complaint of sleep hahaha,joy
872,They have gathered to decorate this wall that is from you all of them and as a question a person and whenever I can take care of a lot of care and love the amoooooooooooooooooooooooo silvia sosa,joy
873,Person like this is my friends,joy
874,Finally it has cost but here are a lot of time,joy
875,Work that my beautiful little angel receives me with a lot of love has no price ♡♡♡♡,joy
876,I adore you son Proud of You After Two Years IM Officially A Harvard MBA THANK YOU ALL FOR YOUR SUPPORT AND CONTOURAGEMENT THROUGHOUT THIS JOURNEY After two years Finally a Harvard MBA many thanks to all for your support and support during this trip at,joy
877,Because my 0 children are thinking of my at country club the beach venue forest,joy
878,Credits credits in the journal the nail credits,joy
879,Person tamo burlaoooooooo jejejejjejejjejjejk seer was k saw that,joy
880,You know what is for you! TK,joy
881,Person person I thank God for a day as today almost at this time I send you to this world so that I had a family that loves you and loves you so much teamomami congratulations on your days,joy
882,Good morning friends happy Tuesday for TO0,joy
883,PICAPIEDRA bar Your first choice NFO and reservations 000000000 000000000 Gran Via de les Corts Catalanes000 meters L0 L0 Plaza España,joy
884,The Parque Chas neighborhood,joy
885,ATTENTION TO OUR FRIENDS AND CLIENTS FIGRAL SILDENAFILVIAGRA with 0 tablets 0 x 000 and if they add us to your facebook the third is free,joy
886,Person Saturday Dadaumpa PR W Ale Lucato Derek Los Cabrones,joy
887,Direct classification for the final of the League and Gano Wur Club WINS Again avenue anecdote of the day see how my rival is committed suicide with a pack of negation in the quarterfinals Buahahaha D Person and Person making Top 0 also D,joy
888,X Strut to Capital XQ La Xtrañoooooo EnqualAh Yes Claro Q To My Flia Also JA JA JA WITH LUCH,joy
889,My gift today,joy
890,A MILLON OF THANKS I LOVE,joy
891,Smart Shopping AT Body Perfection System Neogym,joy
892,We convince us that we have to continue fighting against the traitors inside and outside,joy
893,Homes now and always Merry Christmas Jimbo JM,joy
894,Thank you God x give us so many blessings in our life that we can ask for more we have a nice prince and now we will have a princess my lupita happier I can not be,joy
895,Apapañas de Aguayo Super Comforters,joy
896,Person Tourist on Ostend Beach,joy
897,"Only depending on you, my God, thank you for all, God, we love you very much",joy
898,Merry Christmas to all colleagues and students of the UNMSM Alma Mater from many that the 0000 is prosperous for all,joy
899,"Good morning, it's an excellent start to the week for all today we started with national videoconference",joy
900,So we have finished with person and person,joy
901,Varied figures in balloons with their illusions and their healthy humor will make your party something unforgettable info 000 0000000,joy
902,Thanks to my god,joy
903,Life has to know it live and live today as if it were the last day of your life but healthily,joy
904,Zoey I would like to person follow with the programming of Zoey 000,joy
905,And CD0 Equipment of Bocas del Toro who is of heart that a real team proud to bring something that identifies us that we are 000 Bocatons supporting our selection Top Bocas,joy
906,The Birthday Birthdays AMIX Pasatelaa Superrrrr Tqmm Beautiful Kisses,joy
907,My beautiful princess and iop I adore you my mor,joy
908,"LIKE Photo Today by grace of the Lord Jesus we are glad to share next to P person, his birthday our community expresses his joy to be able to live with him congratulations on his birthday father blessings",joy
909,Person and poleras of change we are waiting for you,joy
910,Carla Person to my cousins hurt who hurts person,joy
911,G Morning USA Good morning Spanish-speaking world Happy Thursday in Sabinas Hidalgo Mexico,joy
912,Mmmm the richest I would not tire me eat it a carapach stuffed a crab salad with a crab with crab a cooked and many more mmm than rich,joy
913,feet the percussion asks and the body wants to answer the one that moves well with the mouth does not have to talk,joy
914,The best,joy
915,Ooooo if all a person,joy
916,Peru how nice is our Peru,joy
917,In heaven where the thief person stealing them where the caterpillar can not eat tranquil God has seen you battling and your blessing comes on track good is God to person the love that nobody can give you the peace that surpasses all understanding I love you my Lord Jesus,joy
918,Good are 0 of the lucky person back,joy
919,Singles Weekend Barcelona When you give the sprig Saltais fast and tell you the truth exaltais hahahahaha how beautiful is the amol hahahahaha,joy
920,As Chulas Can see starting to work in Catalog Spring Summer Wait for Get Shoes and Super Accessible Made to Manita,joy
921,and extraordinary day I all started it at maximum speed to give it,joy
922,PERSON  happy birthday yuri,joy
923,EI 00 SCIENBRBRE PAPANOEL ME BROADED THIS GIRL TAN BEAR,joy
924,My new Kbna house that good El Paso Texas Juarez Chihuahua New Mexico Random,joy
925,with me thank you I give you friends for being here and a mega greetings and millions of kisses,joy
926,My most sincere Person desires have a year full of blessings and love that God takes care of them and bless you where person who are happy new year for all my family friendsay enemies,joy
