,text,emotion
872,"Person Congratulations, my little big man three months of life, I love you, my love with Alessandra Preatynha",joy
873,Rare and odd diamond we will be,joy
874,Person Person Let's get wet in the rain of the Lord feeding with this our love to make it worth everything that agent,joy
875,Brenda Person and we are already with the foot in the week Farroupilha Our biggest date Our biggest moment We invite everyone who can be with us in these days in the presentations that we will be in this week we will be in Giruá Santo Antônio do Palma Erebango and Farroupilha,joy
876,Person and when we think that person forgot that old and silly will he shows us that everything is in his time the day yesterday I will remember forever,joy
877,Person Tokando now on the FM border,joy
878,"the age she will also change a little ""Márcia Ulhôa Corner teacher of MC for three years",joy
879,Uniamosolidaria All Food Collected Will Be Donated To The Home Of Mirian And Person Thanks Big Embrace Arkonnan,joy
880,most beautiful star of heaven today and always person's school party,joy
881,Person more than hot Family heat Chats Cafédatarde Ameei Amo Voces Uncles and cousin 0 -,joy
882,Person coming out here thanking you again for the affection received how good to have loyal friends like you even more we are combined so I pray for you and you pray for me hugs Good morning beautiful person,joy
883,Children Person Edinilzaosmar and Leadede Your Nora Person and His Jenos Person Person and Person of His Metos Lucasperson Person Person and Person and Person and Especially Your Husband Joao Marques In Person Brazil,joy
884,╝the wonder wonder knocks on my door lol my finished art ♦ person ╝ ☆☆ person ready and now with the finished painting to person honored in my door ☆☆,joy
885,Allied to a careful diets practicing physical exercise in a regular way any questions do not hesitate to contact you through any of my contacts 000 000 000 000 000 000 votes of a person 0000,joy
886,his face ah this he did not but is to our,joy
887,Person people look how cool this here are young evangelicals of rattlesnake in the parana will make role in the mall so with the bible in the hand to meditate in the word diverse photos,joy
888,Person to cagando repressed pras that do not like me and breaking my two finger and sticks in the ass saw,joy
889,Kiss the Portuguese from the bakery rsrsrrssr,joy
890,Person good afternoon guys look awe the novelty that arrived in the neighborhood best water distributor of the region the king of the waters comes with the commitment to offer a quick and immediate delivery service of mineral water for you call already and ask for your water called arrived,joy
891,Person teen connection,joy
892,Altered drink in the track until 0000 and for the galera has double of smirnof and big aple to 0000 will lose and of course the most beautiful and betrayed guys from Villa Villa you are part of this party in São José dos Campos Brazil,joy
893,Person I want to wish a happy new year to all the crowd organized galoucura clear hills that 0000 is a year of joy and victories for all of us gmc tram sinister,joy
894,presence and the great partnership of person person person person and person person person for everything there tamojunto jô congratulations to us I love you soooo 0,joy
895,Person for you of the face a good night until tomorrow stay with God all you in person bahia brazil,joy
896,Person t j sdale boy person old mass x rsrs,joy
897,Just eye on the caipirinha,joy
898,Person hj I want to make this woman a olevedo,joy
899,So there is the proof what would be of my life without this miracle product You can also win the skin of your dreams Amomarykay with Justina Lopes Moreira and Lucia Mesquita,joy
900,"[PERSON] Sobrinha Querida, [PERSON] , Tia Te Ama!! [PERSON] ... <0 :0  ",joy
901,In 0000 we will have fun fashionable women and male traditional and personalized pants and female shorts male shorts in jaraguá brazil,joy
902,This partnership that I'm sure is never going to end FRIENDS FRIENDS Sisters Friends Always Person Girlfriends Hosting You 0 0 With Karine Navegantes,joy
903,the skin full of spots nobody believes then there is the test what would be of my life without this miracle product you can also win the skin of your dreams Amomarykay with Justina Lopes Moreira and Lucia Mesquita,joy
904,Person good morning world,joy
905,Person Fun Guaranteed With Jeferson Schwinn Knevitz,joy
906,Good morning to all my beautiful face friends,joy
907,in what we feel and that will live simply sensational,joy
908,he will not have any sequel the doctors said this is a miracle of person fikaadica to all who are going through difficulties and think that person forgot you at the right time you will see the hand of person thank you my god person,joy
909,Dannyhs bday the original mount daniela and person,joy
910,the lepo lepo in the bambis kkkkkkkkkkkkkk Person CRB 0 x 0 São Paulo,joy
911,Person crudo in the people I love and I am happy so I live everything on the limit so so much I cry as I am always with a beautiful smile on the face I am a boy that as they say still lives in the world of dreams,joy
912,Person Person and Provocative Pure Hypnotist pure malice ♪ ♫ Bououa Morning Person,joy
913,You arrived in such a special way to brighten my life and help heal the wounds Thank you all for the nurseryFeliz Christmas to all,joy
914,Person person my own business person now you can count on me as your beauty consultant,joy
915,commtocarinho,joy
916,Person this person and simply wonderful and the person who cried when I choreique smiled when I smiled simplified always did everything for me mabter in pe me many forses today I only have to thank you maninha I love you from the bottom of my cholacao,joy
917,Confraternization Center of coexistence Person family Magdalena Arce Daou Sejel Person of Person Person was to say goodbye person,joy
918,Person for the other friends Good morning bjs,joy
919,Good night guys hj my animation was more or less like this pokinho of people kkkkk I love me me bond hotel golden dolphin lord all evil looks aff,joy
920,Person alô people dear from all southwest Paranaense Tomorrow Friday has putz hits in Beltrão at the confidential bar making that sleeper beer and laughing bora,joy
921,Person person person angel today is doing 00 years you are very important for me I love you God bless you always a lot of health you are a golden boy,joy
922,Friends of yours have helped Arpal Rescue Association and Lajedo Animals Protection Thank you with heart on behalf of all who make Arpal that person bless you greatly,joy
923,and have happy holidays Merry Christmas and prosperous New Year,joy
924,Is arrandoooooo o o o o o o o o o o o o the xxvi youth congress Iead palmeirinha set new livelihood,joy
925,"This time you see visit me, I miss you, I miss you. Congratulations to little sister.",joy
926,Pearson Day 0 ° Person Theater Musical Cabaret Invites Fifth Band Location Street House Culture House 0000 HS,joy
927,Person hear you saying that I was one more,joy
928,"""When the Gospel is preached all over the earth then it will come the end"" this end but to arrive would cause a struggle and it is this struggle that will advance the evils for it predicted",joy
929,That you are very happy person can count on me always when you always need here with you to give and come 0 happy niver mana synthase hugged 0,joy
930,if you need me you can count on me my son amese be person and learn to have patience with your own limitations all that I want you on this day is a happy birthday my son person,joy
931,Person I do not hold anything that defines me I will be what you want more when I want,joy
932,Person for those who do not know or do not remember come and see or revive this story was once samouco we count on the collaboration of the whole population,joy
933,your smile loose your affection is the most beautiful in my days passed rapidinhopson turning a little man congratulations my life that person continues to bless and help me drive in the ways of Mr. Person and Mom loves you my delicious prince,joy
934,Person person and mother-in-law than 0000 Book wonders for us,joy
935,PERSON Vem pro Russ Tattoo PERSON  PERSON  R PERSON  000 Centro Telefone00 00000000,joy
936,"I love you, my son.",joy
937,Enter our lives giving us wisdom Thank you my love for the hubby that you are for the paizão that you are for our son Our family was the purpose of God that is eternal our love that lasts forever I love you,joy
938,Person uhu without psychosis friends and kiss on shoulder pro repression,joy
939,Person person nephew person looks like he and lindolea what is written in his monkey asympress for this with this monkey already won the vovo kkkkkkk,joy
940,Fucking bigger review yesterday in the skirt baba,joy
941,Person Carnival 0000 0 days of carnival 0 days of drinks released now with the two largest and person blocks of the region More structure Sound and lighting of the rattlesnake Banguela soon the abadas reserve your 000 first with special price,joy
942,Person Good morning p that it is beautiful and sweet your awakening that in it finds all the beautiful things of this life The singing of the birds The perfume of flowers The smile of a child The purity of a look The warmth of a love,joy
943,Come see the news and try the delicious shake of maracujá mousse you will love enjoy and bring a frienda so that eleca can also enjoy a healthier eating person ribeiro at stepephanie and person person herbalife,joy
944,tell me more things than many people try in a thousand words you are not of the same blood nor has my last name but it is in my heart and will be forever I love you very much 0 with clair person,joy
945,Person I love this person you liiiiiinnnnda,joy
946,"Person Thank you, my God, for another one freezed me with all malamém",joy
947,Person I love them more,joy
948,I went to the cradle because I'm here.,joy
949,Person family gathered at the house of Uncle Person,joy
950,Person I do not worry about what they think of me I am what I am I have flaws and good things truths rhyme with my life the rest is a matter of taste,joy
951,Person happiness comes at the right moment in which person decides and not you obg my god for everything for having sent me that person so special 0,joy
952,Person only to remember the MCs and entrepreneurs who today and the fellowship then book soon their transportation for the weekend with Moacyr Train Bullet Transport and Events Ltda Speed Comfort and punctuality and only call,joy
953,Person my new rehearsal raina ferraz amei tri beautiful,joy
954,Person today completing a very happy born week looks ai black person he de bonezinho,joy
955,go through the difficult times at the time of the dirversoes at the time of friendships in the jealous and fights I like many of you jokes united,joy
956,Person ♥ If I could choose one thing to keep forever in all the whole universe without any hesitation would be you person,joy
957,Person nothing better than to overthrow with a smile who one day hurt you with a tear,joy
958,Who's good to have a person who leaves the person happy,joy
959,Person coming out with the family for lunch Domingão in São José dos Lambs Paraiba Brazil,joy
960,Person skate board's every holy day to get evolution and overcoming living to the old mans and the children Oman faith in God and foot on Taboa,joy
961,people who cry their fears that bloom love in life sprout forgiveness and faith be strengthened is just what I desire for this season,joy
962,Person person and son with person person person powerful,joy
963,Person person very much with the little that we lack and we enjoy little the very much that we have,joy
964,You blow in the right direction,joy
965,Person life is all good the late divine afternoon many things boooooasque misses that I was,joy
966,Person I do not need to get drugged to be a genius I do not need to be a genius to be human but I need your smile to be happy,joy
967,Person person who hurts us and tbm oq shows us the true face of the people can be a word if she was thrown with an irony tone you will decipitate more tbm will conhcer who really hides behind a guy who just deceived you,joy
968,"Person, I will not work for anything",joy
969,provided for all these years of your existence stays with God Gabriela Deschamps,joy
970,Person ending the day looking at this has no price,joy
971,difference is in our good actions,joy
972,Person a simple mousse of chocolate made with love affection and caphallornase a mousse more than special 0 0 0,joy
973,Person but it is worth the discomfort of the truth that the convenience of the lie,joy
974,Person Nois Mete Bala Even in Men Good Night,joy
975,Person Good morning Spirit Holy Good morning my friends L'Souza,joy
976,Person with every fault a try on every stumble A resumption aiim I will go to a front good night,joy
977,Person that Brady Pit That I'm Nothing More I,joy
978,Person wants to have a look,joy
979,Words of professes in the lives of the welders,joy
980,Person • ઇઉ Do not save maicasperdoar It's the only way to find peace Good morning,joy
981,Person the word of person is full of power she transforms heal releases salva console corrects and encourages amen the prophet Jeremiah said when your words were found I ate them are my joy and my joy jr0000 glory to God,joy
982,Person person person does not have my body defined more only in me feel very happy and is healthy is already more than good,joy
983,Join the production and communication team of the Rocha In Roll Integrated Arts to Cold and Beautiful City presented us with an end of the delusional afternoon in the ruins of the Fort of Dom Pedro II,joy
984,Yesterday Ew and the Linduxa of the Porcarian Salao Byjamides,joy
985,Person today is cell day ️️,joy
986,Sensational is already worth it for you who want changes to 0000 person,joy
987,Person this is tanned the night with my mother vo tassiani and ronaldo I love everyone,joy
988,Big hit person as promise is divide here goes the link I know that my will share type ideas,joy
989,"I love you, I love you, I love you, I love you, I love you, I love you, I love you, I love you.",joy
990,Person and Nois VABRASIL Lucas,joy
991,Person good night holiday super tasty,joy
992,Person I and my two princesses end Sunday for tired palm rodeo,joy
993,Person • whoever see me watch me smiling and will always be like this in Brasilia federal district brazil,joy
994,It was up to 00 hours of the morning kkk skol samba improvisado person looks nois ai drinking tds rsrs outside the tin full on the table still rsrs was the first ones we stay until 00 of the morning rsr tamironetinho,joy
995,of rock and serving the various requests from the Pearl Jam Foo Fighters Pink Floyd and others you decide the show The house has a broad menu for everyone to be able to dine and drink the will call and make their reservations 00 00000000 The show begins at 0000we see person,joy
996,Person covers with your hands with power come hide me sir if the thunder and the sea rise to come on the storm I will fly on the waters you are also person because I know that you are God my soul is safe in you you know well that in Christ firm,joy
997,Carater is what I do not lack was,joy
998,Starting from Barra Funda Quick Box office options Available options Track and premium cabin Open bar Sale points No convenience fee will be released on the day 00000000 guarantee your ticket and gather your friends for this qunic Energy that the Maisvipsunset provides you with,joy
999,CIN M LIMA PERS PERSON AND HOLDER IN THE FEASTS PERSON BOM BOMMM,joy
1000,Shalom hello everyone is asking me if I'm really pregnant yes personal I'm waiting for my first child in the second person I could not stop sharing my joy with you my fans with Raimundo Paulo Raimundo,joy
1001,Person Person wants Pave de Pesego So come and participate with us from the worship of thanks for the year of 0000ieq person I wait for you,joy
1002,feel to see our tears contrary to close friends who look at us and do not really see our pain virtual friends there are yes I love you 0,joy
1003,happy to be able to hold her here in my arms person of this person you are the pregnant most person that I have ever seen I love you very much with adriana andreia,joy
1004,Person tanned the party with my sister and my friend,joy
1005,Person and working in the person glories to you Lord,joy
1006,if they are true friends are already passed 00 years and can spend the time that is you will always be in my heart 0 0 Many saudadessos 000,joy
1007,Usag person people are not needing and I do not want to lose weight so they stop sending me these crap because for now I'm not prescizing thanks,joy
1008,Person arrives from judgment to have you very close to my body is what I need person,joy
1009,Person and my djia started so good djia zamores photo very vowa morecas pitrukas djii I,joy
1010,Person Consulting Shirley Hinode Captain ENEAS Visiting the Hinode Store in Janauba Be You Also Consultant Hinode Janauba Ligue 0000000000000 Tim,joy
1011,Self-love is when we learn to change the word,joy
1012,Person tomorrow the day starts early at 0000 hs from the nightmoon to see the sun rise with this view is priceless,joy
1013,Date with me person for those who are already beautiful do not need makeup person thus totally natural and beautiful even,joy
1014,PERSON  PERSON  PERSON  PERSON e PERSON,joy
1015,Person for tricolors and alvirrouts with amnesia,joy
1016,Person tomorrow we go that I'm going to ITAPEMA Casa de Person Wait for lunch KKKK Bjsss,joy
1017,Confirmed the miningite waiting for the exam to be ready to know what kind and our baby is well breast chora wants to stay in the lap at last this reacting well grate to God person who keep praying,joy
1018,"Person, this naughty naughty of mom nor let me eat right I went to eat bread sweet he picked up comu grape he catches kkkkk that naughty d with miguel evellyn",joy
1019,Never found in you an eternity and the certainty of a great friendship always walking together forever friends person,joy
1020,"Person Bah was very good, my God.",joy
1021,Cool person person that the night was great with them and the morning being great tbm with them and person person,joy
1022,Person Every family person wishes to all friends a happy 0000,joy
1023,Person Person at night at Madre Summer was Duka,joy
1024,Person The more the people comments more increases my audience but I get pop The more rises my ibope more increases my luck ♪,joy
1025,Person if we're going to have wrinkles that it's so much smiling,joy
1026,Person person who said person,joy
1027,Reggae nights person person fucking if he can not stand well waterkkkkkkkkkkkkkkkkkkkkkkkkkkkkkkkkkkkkkkkkkkkkkkkkkkkkkkkkkkkkkkkkk good afternoon person my baby my life today has a new setting is Matheuslindõ da Mamae,joy
1028,Person my son person and his daughter person first bath I love you my life with person,joy
1029,Person Person Above all celebrate not only the turn of the year but thank everyday for being alive until 0000,joy
1030,First friendly this year already aiming for the preparation for competitions this year we want highlights for this friendly the athlete skin's author of 0 belicismos goal person,joy
1031,the gossip in days we will take a lot of cracks and we will take a lot of lesbians in the ballad this only some will understand person the best of me and can count on me when you need junior person,joy
1032,Thank you Lord Person for you Allysom Ferreira da Costa I love you,joy
1033,Person person picture was when it was small and now I'm big was pour cause of my family that I grew well and healthy love kisses,joy
1034,Person I wish everyone you a great day that person illuminate their paths bjs for all,joy
1035,Person spree with the cousins,joy
1036,that you continue being this wonderful man I love you very much,joy
1037,Person Person left home coming out of the trap,joy
1038,Person person and me and everyone in the family are very happyisson is coming a little boy for nois0,joy
1039,Person Big Training Yesterday with the presence of friends person person person person person person person person and person thank you for the presence oss,joy
1040,Person This is also a great option to spruce up your Christmas table can be with white whipped cream chocolate white roses or red flowers or even a Santa Claus in the center of the cake various filling options,joy
1041,X person we make small moments big stories person carvalho iaallaf dhonatan jhenifer cabral junior person palloma,joy
1042,BEAUTIFUL,joy
1043,Merry Christmas to all and a prosperous New Year,joy
1044,Person coming out here bjs for who stays and a Merry Christmas to all,joy
1045,Person disappointment does not kill teaches to live,joy
1046,Person with my,joy
1047,Person cheaper person from the city Contact WhatsApp 00000000 or inbox 0 Elastic beds with less than 0 months of use Security Guaranteed Events Birthdays and weekends Do not waste time,joy
1048,Person coming out bjs for who stays and good night,joy
1049,Good morning Holy Spirit Pray for me it takes to person everything I need from me a week of victory and deliverments,joy
1050,Person last day on vacation awaiting person for lunch taking a beer,joy
1051,Person guys let's twist together but once for our dear brother and a great idol that simply and he's our favorite person that God bless you but once and that all right are cheering for you with,joy
1052,Ready for everything toy with new wheels haha,joy
1053,Person on Ped I'm New Rumo and Pink Rosada House,joy
1054,Person person life is complete of happiness because you rejoice every second of my life,joy
1055,Person Person sleeping with Aunt Gi Today I love good night,joy
1056,Person all this year I was not just because I always told your company and the affection of you patuenses that this trust companionship continue in 0000 person president of the city hall of Paturn,joy
1057,Person Person PrincesMainaisLindadatia Welcome Rebeca Mariah Person Person,joy
1058,Person is not easy did not see,joy
1059,Person kathellyn rayanne julyane fernandes emilly barbosa julia person caua person sarah person mornings lara alves sorry if I forgot someone,joy
1060,Person that you always live in a nest of love and peace health prosperity that you continue being example of strength and courage you are special we love you happy anniversary person person and person,joy
1061,Person such that make a warm weekend that such a creamy black chopp at the price of good chopped chopp right then tomorrow Thursday has black chopped chopped price all day chopp black all powerful Brahmeiros drink with pink moderationStela,joy
1062,accompanied with our tours and meetings for person too and for her company thank you for this class that gave me a great cream for all,joy
1063,"Person reminds us of challenging panties panties unkempt, we could hidden the bottles of tubination to be able to take the bad picole of the worldkkkk old souvenir souvenirs kkk",joy
1064,Person I'm happy because yesterday I went walking and I loved myself dumb muiito,joy
1065,Person gives a personal newspaper newspaper from when he inaugurated the hardcane concert house of shows 00mio0000,joy
1066,we are not only looking for people who value you with amanda conceion,joy
1067,Pearson day 00 December anniversary of my gatuxa nathaly eluziae change of vizu deno back there is blonde amo q ameu and my lindona only in shoppingkk,joy
1068,Otarios on duty kkkk,joy
1069,Person Me and the big person a talent and full of good disposition Good evening to all,joy
1070,Person taking a real beer,joy
1071,Love 0 person I love you!,joy
1072,very gratifying to look at the sea in this night.com,joy
1073,Person for you FCK friends for my loves,joy
1074,PERSON  Osu,joy
1075,Person The Wonderful Cup Cakes of Made With Love By Sumaya Miotto Arrived With Made With Love Crafts Handmade And Sumaya Miotto,joy
1076,Person that comes a healthy bonit for Tobata,joy
1077,Person if I want I go back and I insist until I get something I do not lose my good is an opportunity,joy
1078,Person my love is completing 00 months thanks lord for your protection,joy
1079,and character that has all your concerns dedications and lessons only made me grow I wish you many congratulations and that you keep worthy of so many person qualities by your birthday person I love you very much,joy
1080,special desire that person enlightens us and grant us the blessing of continuing together and mainly united and happy person to be always in their history and make you very happy person for us person augusto,joy
1081,Production BC Binha Cardoso and Team Best Referrals 00000000 or 00000000,joy
1082,that when I am also suffering person in this and I know it will be you that will go me from my happiness I love you but that everything in this lifejesus,joy
1083,[PERSON] to de ferias oba.........oba,joy
1084,Person 0 Koisa Linda of Auntie My Barquinho Maykon Felipe When I Was Baby 0 0 With Mariana Dias And Adriane Silva in Person Brazil,joy
1085,Person Person Laís Bianca Souza Person of Conceicaokelvis Nunes da Silva Danny Lima Rafaella Ribeiro Tony Filho Jerlia Person,joy
1086,What I fight tirelessly day after day for my recovery Thank you for being my son Gift Best There are no kisses from Mom With with 0 months old,joy
1087,Person Studying for Science Proof Tomorrow,joy
1088,Person I never change my way of being who likes min no min modifica complete min,joy
1089,thank everyone who attended possession thank you very much,joy
1090,get gratitude and axé of light,joy
1091,"Person is never too late, does not leave the darkness a new day New morning, the same house has open doors certains and siblings",joy
1092,Person The tram does not walk with exchanged is card without limit only hundred bouatardeeatodus notes,joy
1093,Face-galier,joy
1094,TOday  DO You,joy
