,text,emotion
0,Person now the bug will get to speak is easy I want to see is by Réé Poka Idea and very Rachaa,anger
1,Person that pity passed 000 posts by my face yesterday only 0 cited the Republic will be that we lack civism and love to the country,anger
2,Phod good morning rs for those who vote or voted on the pt accompany aii ó only shit these know that they will not get anything else from there the attitude of steal enough not to lose the custom rs lulalá,anger
3,Person This is the state of the street Doctor Areolino de Abreu in Honorio Gurgel and Mayor Person said that the river surpassed the rain imagine if I had not overcome everyone there had to die for someone to look for,anger
4,Ufa ufa person that night horrible without light all night arrived AGORINHA aff,anger
5,Person knows so far I can not understand there are several campaigns against child labor but they use children actors to demonstrate this then children's actors and singers is not work they call these professions that even,anger
6,"for the 0000 bicampeonate by kindness pass this message for as many people as possible so that everyone can know the dirt that rounds the football from now thank you for a hug, person globe of journalism where football has arrived",anger
7,Be at peace for sure must be in a place better than this where we inhabit,anger
8,Vica a tip is the tip ai partner after we are d Lowest turn still fucking down on a day and being fined the other day for this demoted and with neon,anger
9,for children can this where the secretary of education is not the best now where you justice of shit that does nothing nana person to person did with this tansa is little she has to take much more person of shit,anger
10,I ask and if a catastrophe had happened and there was a need for this amount of donors to save lives like Hemoes,anger
11,teacher asking one thing and falling another person must be turning in the coffin and we still have teachers who in the next election will vote in this cretin only lingo for these sad disappointed and feeling injured,anger
12,¬¬ Person looks at the prejudice,anger
13,Playing with the lives of people who need this transportation to get around for their work and residences is more fun,anger
14,Surreal Hospital of Clínica São Gonçalo What is worse to die in the corridor of a public hospital or pay this ae who are charging Riosurreal Quabsurdooo at Hospital das Clinicas de São Gonçalo,anger
15,Person looks at this face I know a lot out there pretending to be an angel and inside a rot affs is disgust but one day Mascará falls,anger
16,Person won an Xbox and wanted so much to show Pro Manoel Tavares,anger
17,Only 0 person,anger
18,because each one has his own story does not compare his life with life with the other of others you know how the path they had to tread in life good night ah and the tip,anger
19,Here is the reason for the hatred of some Ministers of the STF against the companion Zé Dirceu,anger
20,Person is not easy for you to stay years and years waiting for justice even more when we waited to take care of person a very sad life so that I only believe the person of person person cole and person,anger
21,Thank you very much.,anger
22,Good this plague is fucking boring boy fucking naumm talk but with me,anger
23,Judgment is a shame,anger
24,Person shock to the student that absurd is this,anger
25,my party hand ruti person the justice will be made some photos of the individual bad character anything warn the police,anger
26,Person and have to wait sitting even because in peans there is no perfect man,anger
27,"more likely is that we are before the ""beginning of the end"" of another relationship ""love and facebook have mto care know how to honor what you have""",anger
28,Person ai what hell this fucking tim will not even a sms for anyone q shit already turned off an 00 times and nothing tim,anger
29,Person with this heat,anger
30,Person Sometimes it is necessary to recycle to continue in the center of the will of the Lord in Recife Brazil,anger
31,Person will be going to Karaca,anger
32,"Person fucking me with a pair of poblema and these people who do not have to do is still gossip I will try to say yes, no right, we take care of another way",anger
33,Dude people people,anger
34,"Falcatruas plus you with your vote may well choose better who can fight with you by your rights person ""Sorry for the mistakes""",anger
35,Person os arom bat ai hous pel ai tlai,anger
36,Person there with so much harm,anger
37,who financed among other election campaigns,anger
38,after using please stay at home playing a play,anger
39,Abandonic anti-abandonist follows facebook of coward,anger
40,God where we are going to stop politicians like this this is for those who elected people please do not give powers to those who do not like person gives in that they pay attention to who vote a shame this senator,anger
41,Person aggregates value,anger
42,Person fact we know until the phone when it does shit or is lying person,anger
43,Person that shame that disgust if it happens aff end of the times News table centers souvenirs t-shirts personalized and more want to know more of my work me add tbm on orkut it has several models of everything you need and what I did not have,anger
44,Assess me that person,anger
45,Person vstrombrasil in my opinion I think absurd the bubble of the fat do not have treatment antirisk which paninho already scratch the acrylic the cost of the bike should add quality also in the bubble,anger
46,Person honestly I'm sick of this punch tired of boring joke every day,anger
47,Plis Person Please stop sending me invitations to Playon I like to play,anger
48,Person person because it is me so do what it does not use to pass the leg because the righte is fair will be charged person is friend of the person and she confuses things like this does not,anger
49,Person if I drink and my problem if I turn the night and my problem if I like binge and my problem of my life I take care of me that xero good afternoon,anger
50,This person indignation quota is the full statement of public education bankruptcy in Brazil How many rich blacks there are How many poor whites there are the quota system should be analyzed according to the social class and not the color of the skin,anger
51,Person a super heating caused this on my iphone0 care if you have a,anger
52,Dignity more health and more education,anger
53,the advice of those who have already provided service for the city hall of solidarity but not and were sucking the good finger if it is bad for me imagine the owner of the kombi ah mark your friends there person,anger
54,Person The cruel doubt,anger
55,Person this is for those who have a disappointment with friendships with teo silveira and paulla vegas,anger
56,Affscm to with rivamarília instead the favor of catching the scissors and cutting the hair out well that gives for unfoldingkkk but it is so every child has its phase hairdresse,anger
57,Person honestly I was embarrassed,anger
58,This sums up hw u feel about ur team person person seriously i feel for him but k shit team sincerely bunch of chickens and this person ng speaks pk the person and the prestige kn made a cu and the palerma of the eder did ok plz niggas leaveto be stupid,anger
59,Person headache and ears,anger
60,fries and a refrigerant entitled as,anger
61,Person that horrible night without light all night has arrived AGORINHA AFF,anger
62,seven trumpets prepared for plays ... and became in blood on Tuesday part of the sea will be the end of the world will speak that it is a phenomenon or something like that but the children of person knows well what this is Jesus returning back even person comes to get us out of this mud,anger
63,realize this dream please share the photo of this elementary if you find it or have news of it please get in touch and denounce thank you from ja,anger
64,Even I paid all the expense I had with the person's family 0000fui though and I ask the person to bless him,anger
65,Our family and friends,anger
66,Person is launched the campaign if it did not wished me the good year does not have to say anything today,anger
67,Mr. Person Share Residents,anger
68,Person Crap of the Guarani Feast Plane Nanda Nandeira You still q buy clothes OQEISSO,anger
69,Billionaires,anger
70,Person Person of Mandating January,anger
71,Country that does not have money to invest in daycare hospitals Public transport more with World Cup trash has,anger
72,top of the innocent angels shaking and destroying the lives of these many children say to me that pedophilia is disease so I believe that the remedy is the one from the photo below who defends pedophile for me consenting with what he does then the word aI person's day,anger
73,Person only wanted people to stop playing with the feelings of others if they do not like it is so simple to open the game at once,anger
74,An innovative invention of our planet the trash can,anger
75,earth gives person lie fantasy and madness then hugs the pillow and thinks of us person cheesy with so many regrets,anger
76,Person I never imagined that there was a company so malandra like this tim foolen I activated the internet 0G famous maca slow only I checked a very fast email and then I left the phone in off mode simply after 0 minutes I get this SMS the country,anger
77,Person and as my friends and Nursing TEC say,anger
78,and I use the strength of social networks to advertise this happening person,anger
79,Familiary Thank you peace,anger
80,Person I think it best think twice huh kkkkkkkkkkkkkkkkk,anger
81,"inferior to others for a Brazil that does not discriminate against my genes, thank you",anger
82,We were still arranging the insurance so we do not know if we are going to meet but all help can favor us to find is a renault clio silver plate dtz 0000 thanks,anger
83,Person I just knew that they stole the car today the house door in the new village of the caparica if anyone has any information that tells me pff peugeot 000 blue person 0000oi,anger
84,present an innovative invention of our planet the trash can,anger
85,Time time we do not have for the effective recovery of the lagunar system arrives from degradation,anger
86,Cut people who are in there winning a lot without doing anything lies.,anger
87,Person will have a show of these aberrations that you want to defend that Defend Ministry of Health warning to listen to Calypsopode songs cause serious damage inrestaurable to your musical cultivation,anger
88,I feel it repulsion,anger
89,Person I do not fight for any man only imposho a moral,anger
90,Monstrous just choose products that do not test in animals are no longer hypocritical,anger
91,They undermine and devalue people who surround it every day,anger
92,Ok person person I am rich thin my facebook ta beautiful blue and I have video game in casing pair please,anger
93,Person they like this life to be prisoner of hell wants a proof that they like they leave they come back to commit the same crimes or worse and guilt of who the father is our code and person and equal to Brazil hypocrite,anger
94,Tours with stucks forcing us to take the risk of being run over,anger
95,Intelligence saw pigs in the skin of junk Globe,anger
96,"For the connections between Barbosa with the Aécio Anastasia scheme was political because we do not talk about privataria tucana anyway that if you judge and get guilty, but all of them elect that will be judged is a shame",anger
97,Person there are still people so everything that plant reaps the problem and that everything puts guilt on the devil while and the own person who does not serve me,anger
98,Neessional problems but push q one day justice to be made he will be in the cadiapois who has son knows do what I am referindaq if it depends on mimperson apodresse in the chain still animal afucido of their children justiatacompareille in paranavaí person,anger
99,I agree a lack of respect with the Brazilian family,anger
100,Bandodesemnoçao Revolted TNC Governodemerda,anger
101,That rush circulating in that shit broth but after all that f,anger
102,Person the human being imperfectitope q most is so,anger
103,Person love the distance away in which love is longing and desire ♠♠♠ one day you will miss this boring woman ♠♠♠,anger
104,Heat Beach Hj To Queimadão CRLH Ardendo with Janaina Regina,anger
105,Person PMP PM car is caught parked in vacancy for shopping mall,anger
106,Person Person for us who paid for sewage treatment The same value we paid for water and even more because they pass from 00h in infinitobents and do not have a drop of water in the pipes,anger
107,never had ever walked or if your friend's car fucked because your friend your father brother neighbor is a relaxed who does not know how to take care and if one day he gets any car and not caring will be another car pump,anger
108,awareness of the people tbm has their portion of guilt but it is unfortunate what a long time ago Iguaçu has been going to need a quick and efficient person solution we will share,anger
109,And Isssso Person The PT stopped being a party and became a Faction EN never again,anger
110,Lagunar arrives from degradation,anger
111,That when this chavon is pointing the gun for head itself,anger
112,Access Island Continent Single Access Shame Av of the curses Shameful and if for me I live on the beach It's hard to imagine you that you do not live on the beach My son playing rendering avenue with their railways,anger
113,fundamentalist activism because humans love and never war against meat and blood respects,anger
114,Electoral Campaigns Person Tadeu Tadeu and Marcos Aurelio Santos Reis Reis,anger
115,Person and it is not that it really,anger
116,Fight by other animals by the children and the elderly and by Person Vaitodos deserve a tired chanceInutil chance,anger
117,LackPontalcombrsitenoticiasverphpidnot0000,anger
118,Person nor do I have where to sleep hj rs rs,anger
119,Person in this way msm friend ta rare people p fude has to spare,anger
120,Person Freedom for my partner Nelsinho train bullet,anger
121,Person mae when I'm better promises I'll be able to eat Conceição Aguiar,anger
122,Respect the Northeast Beast Beast,anger
123,things for lack of supervision and governor organization will be fuder and drop our state if it is to do anything that leaves another person to make amapá is in mourning and outraged by all this situation,anger
124,Person inclusive I hate hi because I requested the internet for two months and until today I called three hundred times and the modem until today has not arrived but the collection came,anger
125,I ask the prayer of all to my father because he hears a complication Peunamunia if the remedies do not answer he will go back to cti the kidney is responding well,anger
126,Person funny now wants to be calling all the time I'm not in the mood to meet I just want you to leave me alone,anger
127,like this photo,anger
128,art of restricting the freedom of not harming others,anger
129,now past almost four years nothing was made person here to leave my solidarity for the relatives of the victims of these episodes and repudiate the total neglect with our region by the federal government,anger
130,Person looks vote speaks heinomo that people can be so-to-abismadavc I got the wanna do not forget a thing thing that agent plant collects,anger
131,Person my operator still has the courage to send msg saying,anger
132,Envy all the misunderstanding my trust is in God only stays the tip Who pulls bag pulls carpet,anger
133,Astronomics from the Pharaonic works I've seen this movie in Pan,anger
134,Just person unfortunately I need to live but I do not need to have friendship so my God help me to endure these fake and hypocritical people,anger
135,Person for you who are speaking ill of me and doing gossip with my name person there a little present for you accept hehehehe,anger
136,In the Mensalão of the PSDB was political for the links between Barbosa with the Aécio Anastasia scheme was political because it is not spoken of privataria Tucana anyway that if she judges and arranges guilty but all of them elect that will be judged is a shame with pcdob minas gerais,anger
137,Person person badly knows our parents will fuck you fdp,anger
138,"Person, these songs today saw is to end AAFF",anger
139,Really person is preferential the kicking than the advance to then give shit good quinsexta for all my kambas,anger
140,Person and who darned did not tired that annoying voice that appeal annoying,anger
141,with me,anger
142,I bring my sister to the hospital and I come across this,anger
143,year a work that lasted practically an eternity to be ready with a stronger rain Person congratulations personal the lack of respect and consideration to citizens has been performed in a magnificent way,anger
144,Person Good morning people in the middle of Friday I take medicine but it's good to see if anyone will feel my foulkkkkkkkkhoje I'm ashamed after faith in God I'll be like this,anger
145,Person network sewage television,anger
146,Person took 0 points from Portuguesa and 0 of Flamengo just not to open a precedent in the resource of Portuguese,anger
147,"Person with nervous stress, I'm going to work out to person 00h00 Amais Olympikus to and whatever is profit",anger
148,Person person wanted this but while I'm not sure that things are changing for better I do not waste my time,anger
149,ITUERAVA Municipality We pay our taxes in the day but do not have the right to collect branches looks at the situation of the door of my house on the street JUSTE MIRANDOLA in the neighborhood park of the shamrock there is 0 Month Walter Gama Earth with Ituverava City Hall,anger
150,Girls proof of Damiana Guedes today is or so,anticipation
151,I had done that I did not know how to do but you get over my thank you.,anticipation
152,of our programming,anticipation
153,Person person inscriptions until the day 0000 guarantee its vacancy in the key 00 inscribed person,anticipation
154,And nois people cheering in the house of Aunt Person,anticipation
155,Person and presentation of the part of interconnected interconnected do not miss this opportunity to invite your friends come,anticipation
156,Person my iphone 0c arrived along with several other gifts show being recognized for your work has no price Thanks Herbalife,anticipation
157,Person Person School of Everything Ne But Do not Want To Study I Yes From AtEartersRsrsrs The Malukinha do Roberto Fernandes,anticipation
158,Person this you can not waste 0 years of UCEO from the day 0000 we will be waiting for your registration a great party prepared especially for you woman Plus size of Rio de Janeiro Miss Plus Size Rio de Janeiro 0000 by person with TG Tatiana Gaião,anticipation
159,Person and for the other friends of the face that I did not get mark on the face I wish everyone a happy new year full of everything good in this world person people,anticipation
160,we take you not to be the only one to be person out more information person's event,anticipation
161,agent knows we are together ness force,anticipation
162,Person does not care to madness is that we are happy so haha nobody notices in the face of fear of the baby,anticipation
163,Person Person already your ticket is almost exhausting the 0 ° batch Tickets of 0º Lot R 00000 Female and R 00000 Male OpenBar and OpenFood Premium Sales Online BrerveillonPrime,anticipation
164,forget my beautiful mother-in-law person and the rest and everything else I love you all and that 0000 person that 0000 happy new year your boring and boring,anticipation
165,Passing the holiday hj in the afternoon fourth november fair in the house of carol mexican waiting for some crazy arrive p only falling person girl different crazy and extroverted girl 0,anticipation
166,"thought ""that this year we are very happy"" thank you poor all my loves",anticipation
167,Person Daughter I love you Happy 0000 I wish you much health and happiness Helena with Rose Aparecida,anticipation
168,How about a dry juice belly feeling excited and determined person person summer 0000 how such a dry sugar belly hehehehe,anticipation
169,Personal person help for the love of god share and speak with acquaintances are very worried to help at love pets bath tosa and accessories,anticipation
170,Person handmade soap delights personal soap I can not end up finishing the kits I want to show you to you that beautiful pink we have aki to give this Christmas be sure to make your orders this rose is very beautiful né adooooro,anticipation
171,Person Telexfree in the center of Manhattan in the center of the world this is our international telex,anticipation
172,Person this is my goal for the year that is coming if you liked it very well if you did not like love sign that you do not make the minimum difference in my life gets tip,anticipation
173,00 HS Morning Guides Person Support Person Group Utinga Tracks and Person Beginner Level in Medium Speed 00 a 00 km / Kelho Departure Location Entry from Utinga Environmental Park near Guarita Av Person,anticipation
174,Person but no use only plant has to water and fertilize so that it comes beautiful and can produce many fruits,anticipation
175,Person hummm with this heat take a very cold shake and still keep formshowwwwwwwwww bora pro space at paulo serafim person person,anticipation
176,Representative nilsinho santos person luan person mary messages trj distributor organization biba mary group q samba,anticipation
177,Person will see that everything will work out and soon will be at home again rejoicing our lives tee amoo sort,anticipation
178,criticism is usually who does not have the courage to wake up early and go to battle of the day with Luciano Huck and Xuxa,anticipation
179,very much dreams of everything good in mode,anticipation
180,Person because I'm so super fun,anticipation
181,Person very well advertising the village of father christmas in the grille the exit of the city of port congratulations to whom this is to spread this great idea that arose from the profs of the AEC of Cinfaes and that already goes this year for your 0 edition person and person,anticipation
182,It's going to be happy.,anticipation
183,PERSON cabiceraaoiww0diassóvemexplodiusucessoItambé,anticipation
184,Person 0 speaks guys beauty today I'm passing here to thank you all for the incredible brand where they helped me to arrive with my page we are already 0 million thank you very much for all the affection of always tamojunto,anticipation
185,Top today live music with tati and bueno double from 0000 beer tower fries r 0000 fish portions chicken the finch calabresa snacks,anticipation
186,Person for you to be essence for my vital balance that in this terrace as in the other days people continue to protect each of you bj,anticipation
187,"can not be able to say anything, just thank you from the heart to those who understand this my grandmother's appeal in despair God bless you all of you my contact number is 0000000000",anticipation
188,Secret friend,anticipation
189,in the other to judge who knows is not better to ask if we are not ready for a new look,anticipation
190,Show person arrives joking and we go to a healthy nutrition with a shakerichards and knit mtoooo tears casing crushes,anticipation
191,Person good night guys leaving here get ready soon less has person person 0 0 0 0,anticipation
192,by my beloved brother dear and special,anticipation
193,Bora Share Personal D,anticipation
194,Person Person The official program of Fai 0000 shows The Calendariol provides for a party days that will be held from 00 to 00 from September in commemoration to the 000th anniversary of Itapevacom van Radiorevercom for more this super event of the city of Itapeva with,anticipation
195,Person you can judge with food ok the first baba was a success I hope this is better ok official date 000000 the 0 hours of the morning person thanks for the attention,anticipation
196,Puro Pure Truth,anticipation
197,Person congratulations to my hero for your day in summary speak everything in a few words person my king,anticipation
198,God blesses everyone,anticipation
199,Person person but say that I do not even care July screams in the same corners person,anticipation
200,Person affff person good morning guys and ai javas goes slow,anticipation
201,Person love of my life from here until eternity our destinies were traced in the maternity cruel passion unbridled I bring you a thousand person stolen to apologize my lies my exaggerated spotted thrown to your feet I am even exaggerated person a love invented,anticipation
202,Already has outdor of the best city party in the streets guys,anticipation
203,our prejudices and thus appear with a different speech,anticipation
204,Person of day person tomorrow is already traveling day yay,anticipation
205,in this fervo count on us the,anticipation
206,Person Person came to ask P Santa that this Christmas can find a family that gives him a lot of love,anticipation
207,Person happy bday person people look at that gift all open orchids not even a show,anticipation
208,Purified and free to love and worship the great and most eternal Lord Jehovah our God Father and Creator,anticipation
209,I'll get you tale with you good night and God bless you all,anticipation
210,Person foooi well so kkkkkkk,anticipation
211,Person tickets at Promotional Price Run and guarantee your day 0000 in the Athletic Ararense association has,anticipation
212,and nois person block mixed together,anticipation
213,Person today and tomorrow we will drink né person I deserve kkkkk,anticipation
214,Person lucian castro jana sarmento person football of the gaucho jairo kuba in são leopoldo brazil,anticipation
215,Person Straszia Galera excited many perspectives for 0000,anticipation
216,Christmas is coming that we can stop a minute and reflect on what really this date means within our hearts,anticipation
