,text,emotion
425,Person ta bone this heat then there goes,joy
426,world will always be the size you want to be because in you shines a sun of infinite possibilities today is a day to win yourself and conquer,joy
427,Person aiiiii how good to be happy night,joy
428,happy of the universe I love you and I will always love you I want to thank all the friends the,joy
429,"In control I believe until the end ""- feeling happy that day lindoooooooooooo",joy
430,Person This is the secret of success for all families and companies if there is no union and harmony The group does not resist person in the decade I lived in Africa,joy
431,Person who dares to call me fat mentally I am sending to suck half person thank the friends who are entering the campaign,joy
432,Bora sleep tomorrow and day to worship the person in the afternoon of the blessing with person ministering the word and then cha of the person bjos I love me,joy
433,Person is tenque Daar Person now depositions when he lost no more,joy
434,Very nice event,joy
435,Person first lunch at the residence of Rotter grass,joy
436,P person ☆ bora m tidy to give a role maridao and children love very much td this ☆,joy
437,Person we already burned all the calories of yesterday now let's eat more to have what to burn tomorrow person,joy
438,Person Me and my little brother looks like I was Lourinhã Happy Children's Day,joy
439,sister happy birthday ti amo with wilse cristina my phone 00000000 person,joy
440,Person person person I managed to say there is more tomorrow of class still and the notes I am graduating nor believed when he called me to deliver this bone person deserved for me I am graduating I cant believe daniele pitoli and,joy
441,Foot of the ear promises it will be just mine that will understand me in a look promises that will visit my dreams at night the light of the moon promises to read my thoughts decipher my heart because only so will know that my whole life is in your handsWith Karla Barbosa,joy
442,First advertising on the streetslove it d person a person leaves home when derepende I see a photo made by me in the middle of the city in a commercial poster so happy d d with joana franco and person Portugal,joy
443,sustaining us in faith the power of an alliance as this unshakable is God builds our character well in the unshakeable way in the unshakeable and unshakeable fights despite the unshakable differences unshakable and faithful faithful with Jacqueline Santos,joy
444,Person the secret of a great success is in the work of a great team I am very proud of this team because today when I thought it would surprise I ended up being surprised thanks for the words and the present very happy to be part of the FSG family,joy
445,Person the wheel is our capoerists we are going to be all invited we are a family only here is senzala bjkss,joy
446,complicity if you give yourself gives you without fear than people will think if you sacrifice yourself,joy
447,War is just voting and sharing tale with all until the final person in the heart with Martina Spier and Marcela Camera,joy
448,Person ufaaa finally bed rs show wonderful in the best company me diverse demaaaais tired more for sure it was worth a lot of pity primalinda mamispoderosa ameimto vocêsoDemais fs spectacle with josiane roberta fieldvilla and cleo silva,joy
449,Person smiled your enemies hate this boua night,joy
450,Good morning good morning aaaaaaaa person this tempinho person thank you very much person trifeliz and excited that stays like this for long days ebah,joy
451,Person day more than special with teaching educators CCM D,joy
452,Sunday 00 November from 0h00 in the morning has cityafter at Mary Pop with the Calvent Person RJ Person and Person Missing,joy
453,Person person happy for rever all,joy
454,Person Some talk to you to be well others make you look good with rayssa Menezes,joy
455,Person somewhere to relax I'll ask the angels sing for me for those who have faith life never has end has no end is,joy
456,Person I deserve as many stars my friends for,joy
457,I love you so much I thank God first and then you obg for everything with Andrey Karllos,joy
458,Person I'm going to smoke MNH,joy
459,the person very love person by person,joy
460,Person Person on the shoulder pro repression passing away Person on the shoulder just pras envious on duty Person on the shoulder Only those who close with the bonde Kiss on the shoulder Only those who are,joy
461,Physiotherapy room person already received many compliments but motion of applause was the first vacuum,joy
462,Person in my humble residence wishing a good start of the weekend for everyone and person,joy
463,SanArtistsDevidade with Severino Junior J and Adilson Nogueira,joy
464,Christmas with mommy mamis,joy
465,Person person I wish to voices that in this Easter is full of amorpazephelicidadesUniao and everything more than god bless you happy pascoa to all you 0 0,joy
466,Cade the grasa person kkk good afternoon to v0,joy
467,Personal moments are made to be remembered with Igor Roberto Vieira and 00,joy
468,Person I would not be anything without the lady I love you Queen,joy
469,Person Person The Gemstone of Daddy,joy
470,Person ai galea happy of more for everything I spent in this life and what I will live daki forward next to a person who likes me new life from the day 00 de january because I will be engaging with a person I learn every day likesmore and newest object of my life,joy
471,Ferreira Events Bad Pinto Learba 000 00 00 0000 0000 00 Do not miss,joy
472,Person I won from my migucha brigado for everything blackjessica dos santos,joy
473,Person person carry the weight of the world but I only have two hands I hope to have the chance to travel the world but I do not have any person plan to be able to stay young so forever without fear of closing my eyes life is a game made for allLove is a prize,joy
474,ArtPort Fitnes a little bit of my Sunday for you good diaaaaa and that everyone has a blessed week,joy
475,Person Let me be a child,joy
476,Words Thanks for this dreamed victory,joy
477,Person you are beautiful that too you are beautiful sim0 in lajes brazil,joy
478,Person aoooo I paranazão comes there the first sertanejo meeting in the pahy event center in guarapuava day 00 of march the party will be with person person and person and juliano,joy
479,Person hair with lightness 0 de formol,joy
480,I love house person Saturday 00 september return to home bar one of the best clues of rs promise of full house,joy
481,Person I wish for all a year filled person peace peacefulegrias love and especially person in the heart that person's person intercedes for all our needs bjs and hugs,joy
482,Person Olha Only Galera My Natal Gift Input Money Pro Show De Scorpions,joy
483,Oii friends and friends congratulations to us that says that my bb would be a man already knew kkk as always mae of mother never flawed my god,joy
484,They like dogs when a child takes a picture of the kitten who was abandoned in his condominium sends us to post for adoption because he fears for his life on the street this gives us hope of seeing animals living in a better world,joy
485,Soil big hug and good afternoon,joy
486,Person and I am always me,joy
487,Person is this day-to-day guys we are ai personal every carta a story each hack a zoom this is the block of the sofa tamo together,joy
488,Person Thanks God for the verb,joy
489,Person starting 0000 with great multiservice news is in the top 00 in the ranking of Technical Assists and Tramontina installers,joy
490,I love you 0 you're like a mother for me person person 0 0 0 0 person,joy
491,Gorgeous Dinda's Person with Dinohehhehe,joy
492,"Person good night, stay with God, bjs.",joy
493,Person person to thank everyone every day overcoming record in my agency marketing media in visits and clicks and sharing arriving at 0 million engagement thanks to all I feel very happy,joy
494,Person person has and naum is going to be little come that there is my peopleoooooooooooooooooooooooo,joy
495,joy of life for everything she has given you now on your birthday person to thank Person for putting on my way giving me reasons to believe in life in dreams in the sorrows and in the joys Thank you for you,joy
496,or by adoption integrated in one ideal of fighting work and win with love faith and loyalty person grow,joy
497,Person never let the sadness enter let jesus guide you and he always filled you from many and many joys because it is coming to your great victory,joy
498,P person after the powerful cell yesterday had until the person ♥ with thais oliveira and talita landmarks,joy
499,"Person person can say that it sounded complaina poois teenho you to make me make me smile at how you are triiste, how much you are peensei you never maiis seer feeliiz deeanus sent you you",joy
500,Person visit my daughters is a great happiness very obg my god for one more opportunity amèmmmmmmmmmmm,joy
501,account and said person every penny only later the trader can notice that the scale had broken however only person knows how much he weighs a prayer,joy
502,"I work, thank you for everything you have provided in my I am grateful every day for the achievements and the defeats too because only so I learn every day more",joy
503,Person in the company of them and only joys tah only beginning person oliveira and mara vieira,joy
504,Person preparing supper,joy
505,Person this is for everyone who understands because I'm alone qm n eh special will never ever go from bjinhu in ballad good night ♥ find mto good,joy
506,love this profession today he got up for the first time fed and sketched a bite to get rid of medicines are in small things that happiness is,joy
507,Person Person Students Person Agt at Uma Patricia Miranda Paulo Person Person Person Person Person,joy
508,Person person perfect with right to the niver surprise that my amr person organizoumais spoiled for having arrived more cedu rsrsmis the qe matters and qe tds qe qe more amu housmg sz obg my linduus,joy
509,Person are the sincere vows of the person and family person,joy
510,"divide this prize with all of you who believe in my work, thank you very much, thank you. The press trophy is ours",joy
511,Kkkk good person with person person person person virginia mesquittagessica rabbit person,joy
512,Person only in the details of the,joy
513,Person that our Thursday is blessed by the Holy Spirit of Godbunk day with great faith and joy,joy
514,Huuuum person cacau show a chocolate show,joy
515,Person nothing takes my smile,joy
516,Person Hou Ki I Sintuh For You Never Feel For Nobody Divuhmeuplincipehmeu With Weida Daa Siilvaa,joy
517,Person Dantes Eramos Primos Person,joy
518,lose what the child's world has good and magical is very happy on that day that is your birthday and in others also many congratulations congratulations happy birthday my son mama and I love you very much,joy
519,Person Thanks God for the house that protects me from the rain ... For the cover that warms me from the cold ... for the food that makes me hunger ... for the work that sustains me ... by the family that loves me and the divine protection that I have every day Amen with GilmaraGuilherme Soares II,joy
520,Person the tree planted with love nobody knocks up true friendship also plant trees creates rootsquem cultivate amizafe also thank you very much,joy
521,I love you when you love your brother in person be you a worshiper living the gospel with intensity and discover the power of person operating in you believed inappromessaseInkevemDedeus,joy
522,Person very good just looking at the movement on the edge of the beach with Cintia Teixeira and Sadan Duarte,joy
523,for you with repressed feelings and everything that bothers you throw away because every problem should be cut off the root freeway than it does not lend in your life because who walks with a bag on the back is Santa Person and we know perfectly that he never existed by personwith,joy
524,Person the friendship doubles the person and divides the sorrows 0 can count with me for everything 0 S0 with Emmily Avelino,joy
525,Person only who knows how much I'm in the career aee and qm knows how much it is effort person strengthens leaving a curti aaae thumbunt,joy
526,Nbs studio person pe front now is so person rigor and delih but a few days to be alder lih ne facebook kel familyofficialnbstúdioooo str0 cash production with elly shine person and person paris,joy
527,Person every day that passes amu that amu more this little one fills me with joy see this little laugh very happy to have a person so important in my viidinha teh amoo sa little lindinha,joy
528,Person presentation at CED 00 secondfeira 000000 We started the Judo classes of the CID center of sports initiation,joy
529,Person Best World Academy 0 World Best Academy 0,joy
530,Person the business is the following do not repair the faces ehueuhhuehe turning the night with the best for varia to d eye closed 0 brenda beautiful cmo always,joy
531,Person Invitation will be on the day of February The launch of the book sonnets Pocket Poetic Anthology Schedule from 00h00 Local Restaurant Carpe Diem 000 Sul Brasiliadf,joy
532,yesssssssssssssssss hello dear friends good morning final friday a great fds blessed to all hugs,joy
533,Person New Tapetentended Message,joy
534,for mutual affection the beast gnawing your prey can be happy too but only humans can feel affection for each other and this is the greatest realization they can aspire,joy
535,Dear good morning we will have party let's celebrate 0 years of the,joy
536,"Person left work, I was good afternoon for nois",joy
537,Person mother I love you very much from the bottom of my heart god thanks for giving me this gift that is my mother,joy
538,Person Person The Ladies Society of the Church of Christ Mibe of Residencial Person invites you Woman to the retreat of women who will be held on the day 00000000 in the local church,joy
539,Person ah your boring happy birthday 00 years ta veia in jé kkkkkkkkkk td good that god bless you greatly that you can accomplish all your dream that you stop being so boring kkkkkkkkkkkkkkkkkkkkkkkkk kiss beautiful s0 with jessica vitoria silva,joy
540,and do everything with great quality and respect for all our customers thank you very much look at the titian there receiving the prize person,joy
541,Good Sunday the beauty is a karma that accompanies my familiaperson campestrini caroline person cleonice de andrade person andrade vanusa and elizandro eliet oliveira elcio juliatto sandro salles,joy
542,Send your name and phone via inbox messages by Facebook limited vacancies,joy
543,Person fraternization of the college senac moment of much relaxation and celebration of a year full of achievements of this team I am proud to be part of congratulations eufohart,joy
544,... Sometimes The Picture is Wonderful ... But Never Look ... Good Luck My Friend Person Sometimes life of some surprises mainly when we fish a big fish and we forget to look back,joy
545,Person I and my cookie at the carnival,joy
546,Person Person and Express With Our Dermoconsultoras They Wait For You In The Shopping Island Shopping Floor 0 Renaissance and Paparaubas,joy
547,Person Desire Memuiiita Health Divinasque Daddy Person and that Our Lady covers you of many BlessingFlicidades,joy
548,Person began to change a new person to 0000,joy
549,I wanted if I had you just wanted if you had you,joy
550,Person passes quickly 0 months of pregnancy already with bigger happy belly DMS,joy
551,Person that delights of prestigious cake made by person n is for nothing n more ta great,joy
552,who participated in this great help remember that we help the municipality of Itaguaçu I am sure that the Itaguaçu people will be very grateful,joy
553,Person Person The winner Person of the 0 ° Place of the Very deserved Christmas Contemplates We are very happy to deliver the D Prize,joy
554,Amoooooo 0 Juazeiro do Norcara,joy
555,Person story that is in the magazine,joy
556,Person person my princess that daddy of heave bless you every time but I love you very much your dancing beijoooo person your beautiful,joy
557,made you there that will like the turn to take a lot of caring we will extrapolate the limit of our life that one,joy
558,Congratulations to all,joy
559,Person after I saw this scene I realized that my Christmas was worth it,joy
560,Afters who is a touch uauuuu valeu galera,joy
561,enough for you to put into practice but start today source 00 life lessons by person,joy
562,Let's continue friends person.,joy
563,Person I guarantee best option will blow with Marilu Barraginha,joy
564,Person is the important thing ñ is the obstacle that knocked us the important thing is the force that made us raise and change the history of our lives,joy
565,Person ta good the baby was good but I ate tudoditudo person,joy
566,I love mt bjs it was very good to have met you,joy
567,Person my little baby today I do 0 months Barbara Hellen Auntie loves both with nestor duarte,joy
568,Person person in the morning with mano ♥ EVERJUMS ♡ PERSON,joy
569,Person and person I wish everyone you a happy 0000,joy
570,Balm 0G to make your lips soft and soft,joy
571,I'm anti tattoos kkkkkk person so it's k on Sunday I'll do more one hehehe person and you have to wait a little longer,joy
572,Person when you are looking for something wonderful do not search the universe looks at the mirror the reflected and the most wonderful and perfect image creation of God that and my dear father,joy
573,Dayaneiranilson ICBreno do ParedaMarcelinho Oliveiramateus alexandre and among others thank you for each of you to be part of my life0 a wonderful Christmas and a good new year for everyone,joy
574,Person Person of My School Goodday,joy
575,Sadness in health and disease in the worst and we better moments of my life I and Thayná thank you from heart for all affection I love you and come new smiles new stories new people and new achievements in this new year that is for vim happy 0000 with,joy
576,Be happy as far as you can as far as you can without delaying being happy so much that lasts is crazy to throw away all the chances of being happy because a try did not work,joy
577,Person person person my loves will have a baby papai person costa,joy
578,Person Congratulations late for my friend Victoria lived kkkkkkkk bjs miss you friend,joy
579,Person family gathered aunts and uncle second with Sunday,joy
580,Person 0 months ago Helo,joy
581,Person I love these my migos 000,joy
582,cool I prefer the second option,joy
583,Person mega fit club morning nothing like starting the day in the best way c 000 friends with teresa fonseca and sts center Vieira Leiria,joy
584,PERSON PERSON olha PERSON,joy
585,Good morning pa all the kittens of my face to and ugly pros too,joy
586,Person strolling with Tiu,joy
587,Person to my relatives and friends that I love a happy Christmas and do not forget that my niver is coming and I want to be remembered not only by message ok kkkkkk but otherwise I love you all and I want you to be very happy because I know q tbm willwith,joy
588,Person I already knew rsrsrrsrsrsrsrsrsrss a great afternoon people,joy
589,we will pass unrealized dreams will be part of our life the fear will accompany us side by side but the good is to go through all this and in the end give a good laugh,joy
590,Person soon will be the before and after the Goiabinha Ronda is even happier despite being a long treatment for her and for the guide,joy
591,On the first day I continue with you and your choice is your decision to always your favorite 0,joy
592,Person and that you come and make my days shine soon less praiiapraia,joy
593,Good morning person by exactly everything you have made in my life amen,joy
594,Ok person person in front that serves as motto of life,joy
595,Person my new cell phone a tablet,joy
596,were present as well as managers and colleagues of parliament is Dilma again,joy
597,Person and the main reason for my happiness may be a little early to celebrate because the Lord is still not totally recovered more thanks to God the Lord had an improvement that makes me happy,joy
598,Le person the brother positive energy there for your arrival the strength of person in the first place will work soon you will be here with us zoando person,joy
599,I really liked Person Uauuuu nor need legend I liked it a lot,joy
600,Person Bolotortuguita EueminhacunadedFizosMiam Maim Delicious with Andreia Nunes,joy
601,Today I was baptized by the Holy Spirit I am very happy My life has changed a lot without you I am nothing Lord I love you,joy
602,Person person I want to see you leave now,joy
603,Person Bora watching person marked by Bad with Éverton Hernandes,joy
604,Person my spider,joy
605,Person after a wonderful samba with friends so I left sleep,joy
606,everything remained in box 0000 reais thanks to God this is ozzneiros vamo ki let's,joy
607,Family in IASP Person Saturday happy with the family in Iasp D all the best and I great as always of course Amooo,joy
608,a single vibe thanks for the affection and respect let the music play fotovitrine pictures,joy
609,It can be so special or more significant than the friendship of you for me Merry Christmas to all of you and an 0000 full of love and victories Silvanadorovc,joy
610,Person's present as the person did on the day of mine but I offer you all my purest and sincere love I love you infinitely my super hero with rosemeire sales and liliam johnny,joy
611,Person These and other questions you will find out at the Institute you rs,joy
612,Lady,joy
613,spectacle without public a heart without feelings the soul identifies when there is a story of two hearts the stars are reborn and the show is applauded standing the strength of two hearts is immense person the time and sail with the happiness with silvanna santos,joy
614,Person she talks about me think of me 00 hours a day because she knows q nunk had arrived at my level,joy
615,Person beloved daughter,joy
616,Teaching to keep all the things I have ordered you and behold I am with you every day to the consummation of the century,joy
617,alhia fikaadika and another thing who pays my college my travels my car and gym is me beijinhonoombro pracurarrecalques,joy
618,Person Happiness is not having what you want is to want what you have good afternoon,joy
619,Person person was very happy with all the family reunited when person means my person arrived with a gift for a car that person always enlightens him,joy
620,Person nothing better than waking up with the music that you like playing on the radio good morning my people person person higher than I can not hear you of our life better thing that agent does ok,joy
621,It is urgent to discover roses and rivers and light mornings fall the silence on the shoulders and the impure light until it is urgent Love is urgent to remain person,joy
622,Person Mass Where Vanderson received the Vacito Vestes I am very happy that person bless you immensely person,joy
623,Person my puppy looks like a very beautiful pastor of mom I love you son that person bless you with kella vitoria and maicom silva,joy
624,Ride in Poultry Park,joy
625,bon day che bel smile good day for those who woke up very happy and with very high esteem as me 0,joy
626,I feel beautiful ha ha ha leco leco person the wealth crying when seeing agent,joy
627,Person going to Christmas dinner at Ksa from our friend Rubia Moriracom Luciano Amorim,joy
628,Ultrasound or person 00 Thermotherapy sessions by R 00000 You choose the abdomen or gluteous legs connect 0000 0000 and schedule your schedule,joy
629,Person Avezes I Pego Stop Thinking of You,joy
630,Person d person person is day to review the old friends is club day I have a special list for my guests and friends let's because it's going to be fucking,joy
631,"I need a mother, you're awesome.",joy
632,Person I have to clean my face this year exclude people who have already been enough to meet false low person,joy
633,Person hj my primu person venhu aq at home I miss my nego0 ty adoruh primu,joy
634,Party already seen in apiaí 0 ° Ritmo apiaí fest tdb all di good,joy
635,I love you son,joy
636,Person from day 000 Come prove our homemade toast with homemade sweets that delicious person,joy
637,Sirs say the Bible,joy
638,Pearson example of life my mother,joy
639,Person child play as it is good as is good with flavia roberta gonçalves,joy
640,Person enjoying Expochopimrodio canceladomas will be todaysperson that person,joy
641,Person to all you who make brazilian press the newspaper by your side a great night of rest and restoration person,joy
642,Uuuiiiiiii person person person Saturday to everyone for those who love beaches and fishery take care then let's go to the beach kkkkk,joy
643,Person gets Essi Me and my love with Amanda Souza and Person,joy
644,Person if I forgot someone are invited,joy
645,Things 0 Do not take your holy name in vain 0 save Sundays and parties 0 honoring person and person 0 not kill 0 Do not sin against the chastity 0 Do not steal 0 Do not raise false testimony 0 Do not wish the woman from next 00 Do not covet the things alhia and00,joy
646,Person Eve Christmas and the whole team working There is a better gift that this was worth a team for once again Make a Merry Christmas Difference,joy
647,very ugly this because if I speak badly of you I will speak badly of the other than others do not coveme already forgot me I am that q wake up after a dream of after a tumble person after a great disappointmentapanthe but learning life we need pick up,joy
648,Join that will surely make all the difference if you are a passionate by glazes be sure to check the news of the Aviva line that brings incredible and striking colors to ensure yours is just talking to your person or person,joy
649,Liked shares,joy
