,text,emotion
927,Thank you for being part of my fortune happy year opening the doors to dreams this 0000 and to do so let go empty to start happy 0000 for all person,joy
928,Today in Hippocampo La Paz is Friday of Clams and free beer for them from 000 to 0000 pm Abasolo Esq Jalisco reserves at 0000000 at,joy
929,"After so much wait, the apored Christmas gift was given with alexandra vila and alexandra lópez vila",joy
930,"Maximum every day as it does not exist, I love with Muxa intensity Attecoti",joy
931,Saturday 00 More Party More Diversion Cowboys Disc with Person Eye Stranging if you suffer from nervous problems,joy
932,From 000 pm we wait for you many gifts for all those little angels we wait for you everybody is invited to this event,joy
933,☺️ are LaA 000 AM and already on the D Bimbo floor or ways to work,joy
934,Dear Friends and Customers of Elenites Cuisine Next Departure to Peru 00 January Returning on January 00 I start receiving parcel from today Say limited quota call 0000000000 Guissella,joy
935,"In which all of us along with many friends that we can share this special event that the person continues to ""use ourselves"" that blesses us and keep us happy birthday person director",joy
936,Person hello my friends good day today is happy Friday yupii who have wonderful and spectacular day kisses muac the tkmm,joy
937,ORALS ORALE PHOTO FOR THE HISTORY First Visit of one of the founders of the 0Y0 to the State of Wadesde Mexico Nacho QuintanachidooooJo,joy
938,So it's a pity,joy
939,I loved I am very happy for all those who love me and those who do not want me who are jewele that God bless you and enlighten it as it is doing with me,joy
940,Vamoos River dad we beat those bosteros,joy
941,That forever is your mercy 0 now say those who fear Jehovah that is always your mercy ♥♥♥♥♥♥♥♥♥♥♥♥♥♥♥♥♥♥♥♥,joy
942,Banglasong What will the weekend do,joy
943,While some say no to piracy I say if to pirates Hohoho Merry Christmas and Prospero New Year and Ke the birth of the Nino God fill them with blessings peace love health and a lot of prosperity for all friends and family,joy
944,Happy saturday be part of the coco schnauzi fan page join to enjoy the weekend in the company of our hairy that there is a lot of love and do not abandon them,joy
945,Yoooooo who wants lettaples or some people also know him as fritters,joy
946,Uy uy uya see when I have a,joy
947,In Cuba the Barbaro Marianao the savage stenty that person,joy
948,From tomorrow I start to bathe with person that is good hahahaha,joy
949,Would you like to take this wonderful concept in business attends and I advise you,joy
950,Happy Day 0 Blessings 0,joy
951,we nose the summer person so we are beautiful hahahahahaha,joy
952,Our promotion of the week because we think of you and in your beauty 0 months 0x0 S000 Person Japanese 0 year 0x0 S000 Brazilian smoothing 0 months 0x0 S000,joy
953,Karaoke where you are the invited artist ▶ 000 to the best or worst night singer Dominican 0000 person Norcross GA 00000 000000 0000 We are waiting for you,joy
954,Ke starts the weekend ALV The fucking Stranges SPM net ke siiiiii iiuuu,joy
955,the best thing for you we have it here visit us,joy
956,SXClickHostedButtonidvyWN0B0D0TAGN Davice to Velaí Novagalicia donations Banco 000000000000000000 ADOPTION PHOTOS OF PUPPARTMENTS Looking for Home Telephones Adoptions and Previous Appointment from Monday to Friday Mornings 0000 to 00,joy
957,Very cold Wednesday and with a lot of snow preparing me to try to get to work as it is to fulfill our obligations so at bad weather excellent face q this day everything goes very well with love and the blessing of God with Carlitos,joy
958,The best diet,joy
959,"D0BY0SOXPUJO0GX0PBNE0JCJIYLWVKCJUB0LXLRWM0TSJG0ZLPVEDITUSPSHARING from now, thank you very much Assemblies assemblies",joy
960,Barsa Corona congratulations to our champions,joy
961,I am very happy for our new project,joy
962,imports the money the fame or love of several when you are not here is not worth anything about that only you are whom I should love without fear to fail,joy
963,They left her without words and without arguments after so much to attack us no defense tube and says,joy
964,Grace and Person,joy
965,I already have a job I feel of person today and person all the blessings that you give me and person to all my friends xq always have been with me in the good and in the bad gruss people their advice and their words,joy
966,overcoming and more optimism to undertake new anhelded goals and sincere smiles to share and motivate others person to all my people Lindad,joy
967,From commune Montañita for the whole world,joy
968,I hope that or this is not my case BB Bere Tatu Volkova,joy
969,Good night friends and friends happy night sweet dreams until tomorrow if God wants,joy
970,Think before buying in the liar good end and I'm not angry,joy
971,PERSON de PERSON,joy
972,Utility required for women recenant and newborn babies thanks to all for their apollo recount is appreciated their collaboration contact and 0000000000,joy
973,Tigers Monterrey and the rest of the ekipos losers hahahaha happy,joy
974,Nothing of person.,joy
975,Good night I say goodbye with one of my best reflections happy night my people,joy
976,The advantage of us when we are Golditas is not hiding anything hahaha happy tarreds at all 0 with alex diaz and cesar sanguino,joy
977,DROGUERIA UNIVERSAL is located in the race 0 0000 Hours of 0am to 00pm How to apply to the offer DALE click on I LIKE We will send you a code to redeem maximum 0 offers for each client,joy
978,ajjajajaj Another title but Sake with so much sacrifioppp jijijijij p,joy
979,To work for person to work Ameeeen Ameennn and Ameeeennn Person is ordering Tooodo in my life the past in the past will be aleluyaa glory to God,joy
980,Of Early and attending in order of arrival,joy
981,The piece that can not miss this summer 0000 in your closet in RM,joy
982,This beautiful day was born the great love of life my beautiful baby q is fulfilling 0 animos congratulations my brayan I love you muchoooo my baby congratulations,joy
983,"Monday to Saturday from 0000 to 0000 hours continued, the production of personalized bowls begins",joy
984,Wednesday for all that in this day is of many blessings of God,joy
985,Have a great day,joy
986,I kiero a lot of person,joy
987,Person Contest Contest Contest Contest Contest Contest Amiguitos We have a new contest for you whoever has more,joy
988,The family is the basis of a society make the samples of sample instruments of values and principles you can happy 0000 for this great family of social networks health,joy
989,My son helping me wash the dishes,joy
990,true to learn to be leaders and not simple bosses,joy
991,talented family person person person person person person person person person person and all those who essay after essay came to bring us good vibes to encourage us people await them on December 00 to rock the pearl,joy
992,today cordino group the mountain 000,joy
993,Siiiiiii rock pop Peru Peru country rocker one of the countries with the best rock in Spanish D and,joy
994,important is that he feels happy knowing that makes us happy,joy
995,,joy
996,To all those who support us and help in this the tickets are for sale for any questions communicate with me or with any student of the institution,joy
997,Excuse me but I do not know why someone likes my room hahahahahahahaha the boy cheerful and arriva mexico k we are already at the WorldJajajajajajajajajajajaj Cuidense my race,joy
998,For your little leathermute comfortable,joy
999,Very good day friends happy Monday that they have an excellent week,joy
1000,NEW LOGO MAHMOUD EL GENDY,joy
1001,Good person is me,joy
1002,In this hour I give you a couple of tickets for the Habre Concert La Diva Ivy Queen on February 0 in Club Fuego If you want them as soon as Eskuches any song is called 0 at 00000000000 in Latin Mix 0000 0000 MescarI live person.,joy
1003,✋ Thanks Lord for offering us peace and rest thank you for comforting and welcome us for calling us all that weighing anguish and concerns at palma mallorca spain jesus path truth and life peace and well 0,joy
1004,in the mornings,joy
1005,how andio there is no 0,joy
1006,HLA with my friend Verónica Aviza,joy
1007,Person winged tree sitting,joy
1008,Friends We invite you to the Spring Kermesse of the School Juana de Arco We are waiting for you with community,joy
1009,Person voya r and campaigns to reinforce Blooming continue We are waiting for you on Sunday 00 at the headquarters of the club to enjoy a pretty late with people who feel the same as voj entry cost 00 BS with the right to beer,joy
1010,Person person nor for person and put,joy
1011,For all an affectionate greeting and k today enjoy the day everything k have in mind you are very bunaludos by a person k just gives friendship and a pleasant company grasias to todps person comversanconmigo and k all have person jojojojo with,joy
1012,"Mandatory in case that they do not have can not have access in advance, we regret the inconvenience",joy
1013,Merry Christmas desire her friends from the Ultimate Team,joy
1014,Soon I will go with pleasure after all these parties to eliminate excess fat as a result of such a treat on these dates to look for that painful transformation that Lety knows how to conduct jijiji,joy
1015,For all my friends Artists Singers Actors Actrices writers plastic artists and one that another person out there,joy
1016,God bless you and happy day of thanksgiving,joy
1017,I loved my blond and abundant and long mane but I love short hair with imitation to person,joy
1018,"Do not fall asleep my beloved and beautiful friendly, we know that it is Monday, but there is not to throw the egg aunq be bridge xD D Excellent day women beautiful",joy
1019,Today is a very important day the baptism of person samantha I hope everything goes well as expected I think it will be a good day,joy
1020,Sweet Baby I do not see the time of person my beautiful chubby tqmmmmmmm,joy
1021,"While there is a heart touched by God, Christmas will prevail so white and sweet that you can touch the world enterocums everywhere they tell us that Christmas has already arrived in heaven the angelic choir is heard peace and love for humanity in",joy
1022,What surprise with the superficial,joy
1023,Very grateful to God and all those who support us with His presence in this project Merry Christmas and prosperous new year for all successes a hug kisses with carlos habiague and silvia alvarez,joy
1024,Herbalife changing lives and creating proven stories,joy
1025,Day 00 0000 ha ha ha died person to have in telling us is the best I love,joy
1026,Now I understand xk did not bring me anything xD haha,joy
1027,"Good friends good and blessed is your day the purpose of today praise God to smile for what you long to live in today, annioooo",joy
1028,To everyone in my fb and those who needed me,joy
1029,"Thank God I already went to feed my soul with his word and thank for all the blessings received during the 0000, trusting in God that the 0000 is one more of many achievements full of love and faith at in central Islip Long Island",joy
1030,"Happy year for the whole family PSP0, what all the longings are fulfilled and the person of person came to each of your homes",joy
1031,I liked it and I steal it pa lante es pa lla gentleman,joy
1032,Thursday 00a full rum keipiriñas and pisco sour 0x0 for them,joy
1033,This is my life but I like it,joy
1034,Do not abuse person lol,joy
1035,And that I find this how much will there be your who thinks happy day,joy
1036,you also fill out good energies,joy
1037,What do you want from me if you are brave write,joy
1038,supper supply cool house prima lu all of boom with junior matos,joy
1039,Thank you Noe and Carolina Rios Las Vegas Nevada we feel happy and grateful to God for having found you the opportunity to see and feel better of health with this great company called Herbalife B I E V E n I D O S Johana and Person With,joy
1040,Person of Caminito A Sevilla to enjoy the weekend,joy
1041,loved person wonders of creation poverty humility joy and until all I find the person's face person's face pray for us person and hugs,joy
1042,"New Apocalypse 00 and as a glorious summary of all this our God emphatically declares ""Behold I do new all things"" Revelation 000 Friend Want to have a new life then pray before Him and accept Christ as your personal Savior God bless you",joy
1043,"They encourage to go and do not let me fall thanks for all their personal support without you encouragement every day I would not be able to follow the loves as you can not imagine and I do not say anything else, I got my eyes",joy
1044,Clau never change what you love most in life so you want most at the time because the moments pass but life goes on,joy
1045,Breakfast cake vegetarian Uuffff Chilosa with Josue Bastida AT cakes La Doña,joy
1046,Person ijoooleeesi m happens more when I listen to you my amorrr jijiji person I love you,joy
1047,Person a day like today God gave me the privilege of being a mother for the second time of my black Edriel Person my child who of God of Abundant Blessing and that I can achieve all your dreams,joy
1048,Soon in Croissanteria Chocolat Bar Bread Solidaria Whoever wants to collaborate with the Food Bank of the Poniente is as simple as entering and stopped ina two or those that you want how many more are more families in need of the west come,joy
1049,More information 000000000 or 000000000,joy
1050,Like Delumbrale the night to this heart disillusioned sometimes abused,joy
1051,Person Paulina is cosinating pasta and person,joy
1052,hello the cordial invitation to enjoy in swims 0 years of coming working at our cute public we are waiting for you,joy
1053,Is zumba fitness good morning my queens ☀ If mere is that timpo of the day are ready for zumba zumba zumba 00000000 am I hope in their club zumba ❤,joy
1054,Poor heart that is not resigned has left you I have tried to untime these bonds but is that my heart does not understand reason why I still love you my princesses and loves,joy
1055,Person and person have a relationship,joy
1056,Arrech my pleves bless me,joy
1057,Bermuda triangle ☁ ⚡ ☔ ⛄ ✨ ✨,joy
1058,You are my Christmas gift in Naples Italy,joy
1059,Sometimes I'm so awkward Jaaj,joy
1060,The Four Tribunas Creams We made the party Q is with the outside and David Sergio Roca at University vs. Real Garcilaso the Great Final,joy
1061,tell me if it's not cute crow moral,joy
1062,Nobody can destroy I love you I love you thanks for that beautiful heart that you have with yanina ardanz,joy
1063,Passing a cute Christmas with my loves,joy
1064,Best Papitas 00s 00s Important Happy Hours until 00 of the night,joy
1065,Other GH0S,joy
1066,"Because the people who gleam the darkness and are the most criticadas and it is signal in actually and the light does not take with the darknessBends and do not stop continues forward, not seeing backy forward and looking forward in God",joy
1067,Yolanda Dominguez Thank you for fulfilling my Freck with Clamato Zone Israel Villanueva,joy
1068,I'm a crush classy sjkmm ♥,joy
1069,Casual Tuesday in Sport Center Two forty 000 Gym 000 Person 0000 Chava Zumba 000 A 000 Kike Jazz 0000 A 0000 Edgar Belly Dance 0000 A 0000 MIT LIMA LAMA YESICA ZUMBA 0000 A 0000 PEST NEWS 0x 000 Question for our packages with Antonio Ayala,joy
1070,Girls and is the new thing about the Look of Mary Kay's brochure waiting to go away from his Christmas gifts,joy
1071,The man of my dreams,joy
1072,I only know it and experienced and surpassed and only I have the right d criticarmeok,joy
1073,Lately public transport walks for the ass and older people do not respect at Florida Keys Eco Discovery Center,joy
1074,influenced one day they will find themselves before the call of defending their religion or perhaps until withstanding a little personal abuse for the simple fact of being members of the Church of Jesus Christ of Latter-day Saints at that time will be required of,joy
1075,I LIKE YOUR ALBUM What will the weekend do,joy
1076,We are live the Top Earners of Wasanga Lets Rock Roll the House,joy
1077,For my friends as me if I am a special,joy
1078,Locall with Maru and present as always Dali hopefully Ste better and recovered I adore you person,joy
1079,Take advantage of the sale Outlet with InterJet call us 0 00 00 00 00 00 00 00 00 00 00 00 00 00 00 We will gladly assist you,joy
1080,They bring a gift reports for deposit data via inbox or at 0000000 do not let it happen,joy
1081,And God created man ASU image to the image of God the crevaron and female created them person as they are some females in the image of gods sent a rosatraida from the edendlb,joy
1082,Caliopesalon Yaaaa We accept cards We are waiting for you with our new Horarrio from 0am at,joy
1083,"This Saturday I wait for you in Zona Salsa Manresa because we are going to spin the brown, casino wheel animations and above all a lot of a lot of party come and enjoy dancing in a family atmosphere and in the best hall of Manresa",joy
1084,Person at your orders,joy
1085,M enjoying each instant,joy
1086,"Born thanks to my books, my more than Gols are the best and for me worth as 000 espartaaaanaaaasss au au I can not ask for more kisses hahahaha",joy
1087,Allows you to get away from the dentist Kisses help the saliva clean up and decrease the amount of acid that causes enamel weakening,joy
1088,Person already know Saturday 0 November 0000 Dead Day Texas Next Door and less than a week for the best day of death of your life are you ready,joy
1089,Person and person in life there are times when you have to learn to untie and let go to come new magic um changes of joy,joy
1090,00 From the night Saturday 00 December Person 0000 of the night Thursday 00 December HotelLibertadero Loja Friday 00 December Canton Celica Saturday 00 December Condominium Stay of Rio Loja Saturday 00 December Barrio Calucay Chuqueribamba,joy
1091,Work with the soul sons hands are just one instrument,joy
1092,I feel for you to send them as a gift this Christmas as I find it impossible to wrap my gift from here I want you to know that they are important people for me and I wish you the best at this Christmas party that God greatly bless you and your relatives at,joy
1093,Today we go to the World World Cup person,joy
1094,Here my costs,joy
1095,"Yes, to the flora and fauna noooo to the hydroelectric in Teno Maule Chile",joy
1096,Hahaha to have fun for a while,joy
1097,Today you will drink drinker,joy
1098,Hello send a cordial greeting and many congratulations for all my friends and acquaintances of the whole health sector today that is our day,joy
1099,X end aki this x what is so much struggle and dedicate aki are all my desire to get ahead x end I have my title nurse general this just komienza,joy
1100,A reality is about the laws law is the largest and most noble profession in the world as Giuseppe ChiovendaPor that the law governs the world and nothing and no one is about the laws forgive my sin my beloved God,joy
1101,Take 0 lots for only 0000 € You get the unit to 0000 € Hurry that you have been available until Friday 00 January,joy
1102,Good and if you can not see me x your wall you will see me some face truchy how you usually spy hehehe,joy
1103,My Christmas Gift Ohhhh,joy
1104,Happy Awaken Friends Health Love Peace The blessing of God for you and families who have a beautiful day enjoy it and be happy smiles because the good is about to get a little kiss of good day muaaaa,joy
1105,immense love will provide you with faith and always fill you with your blessings today I will tell you your friend tomorrow you will tell her life so she loves forgiveness and forgettalkm her person person ♥♥,joy
1106,Because I have the best ermanes in the world,joy
1107,Never failure because you are king of kings and lord of gentlemen amnnn,joy
1108,Of Quebrada,joy
1109,New GPS for small dogs,joy
1110,They are all invited hahahaha,joy
1111,Which prefer,joy
1112,Thanks to Sanitary Towels Saba and Radio Stereo Yes and Canal Yes tv,joy
1113,Is the best gift m e brought dad noel with vanesa quarry,joy
1114,have taught to make important and risky decisions my limit is the universe,joy
1115,And I go that IRONIAS MY LOVERS ARE MY MOTOR 0km I love them and I bless you Eternally with Ingridt Lorena Alcaráz Prieto and person,joy
1116,My cute little brother I love him a lot,joy
1117,I go well fart I can not clean my ass to the chingada pa those are dentulating bastards,joy
1118,SIIIII Y SE PERSON Y PERSON   at McDonalds at 00000 Overseas Hwy,joy
1119,"Today, it is one who is one hehehe",joy
1120,SIII for envious hahahaha,joy
1121,aunq say person is impossible if I am happy is person q stress lamenting x things past cm dcia my father if the problem has a solution for what you are worried if you have a solution and if you do not also have to be worried if you person are not going to solve anything with aisha herzand.,joy
1122,See if in my difficult moments you were not in my wonderful moments leftovers,joy
1123,"To congratulate all my friends and family I love them a lot, they have a good time",joy
1124,The rescue that the payment was his sacrifice the life of a king instead of mine the embarrassment that I endured by poor and rich change his crown of spines by glory,joy
1125,Life is beautiful and you have to live singles and recontra happy,joy
1126,The mix of person with the staff the person who gives life to the child person in the sun,joy
1127,a man of good feelings and how to face life without having to be prepared and I know that they are happy from a cloud by observing that we do not shit it in life and from there are both teaching me how to face life without them,joy
1128,Grateful with person all the blessings what he has spilled about my girl giving her health,joy
1129,compañeros [PERSON] yo: La paz Contigo mar. 0 Por amor a la casa de Jehová nuestro de Dios Buscaré tu bien. ,joy
1130,She takes advantage of each and every moment prefers to stay at home,joy
1131,Honda Odyssey 0000 National 0 doors 0 cylinders doble AC tires semi new motor to 000 and transmission0000 dlls or call me at NEX 0000000,joy
1132,Energy stimulation and deep relaxation that provides well-being and tranquility Recommendedoooo with Beatriz Palomo Sacie and Sandra Pina at hairdresser Lucy Ctriana Lanzarote,joy
1133,Person and person person wait for their will was to follow and it will be the best thing is pear to person a great little blessing person waits at me the right moment for about xq I have the best for you even if you only understand about me,joy
1134,I love you I love you I love you I love you tteeeee aaammmooooooaaahh I forgot tttteeeeee aaaaaaaammmmmoooooooooo and would not shout at all vozzz how much I love you happy anniversary amorcissara pd te amooooo,joy
1135,I feel so impressed with the Panafoto Black Friday offers that I should go to spend the entire fortnight to save 00 dollars wowwwwwwwww v v,joy
1136,NEW FABBRICA PERSON FURNITURE PERSON ORDER AND PEST TEES AND COSTS IN ITALY,joy
1137,Your Love Infinitodanos Wisdom And Librams Of All Tentacion Thank You Lord For All My Family For All The Friendships you have put on my way Bendicos BLAGEMANEPROTEJES OF ALL BALL DANS LORD YOUR SABIDURIA AND YOUR SIMPLE IMPORT TO BE MORE OF YOU LORD ARN WITH MAURICIO ORTIZ AND 00,joy
1138,Exact we are just victims,joy
1139,The snout does not deliver dad Kisses My Friend stupid,joy
1140,000 Single Take who has an interested party Search me or send me your request I accept it in Guayaquil Ecuador,joy
1141,Always be happy and you are never sad everything has solve,joy
1142,Is for the fat with Carlos Lorenzo Gastelum Labrada and Thalía González Bridge,joy
1143,And therefore loving others also if you want to be in harmony with everything that surrounds you first you must be in harmony with everything that makes up 0 coherence and affection in action,joy
1144,CRISSY PERSON HAPPY BIRTHDAY TODAY CONGRATULATIONS Have a good birthday cris,joy
1145,MAG YING MY EMPLOYIES Everyone has its position in the dealer Mag Ying Graciela Kitchen auxiliary Damian Chef cooking elayne ATTENTION TO CUSTOMERSE CHEF OF KITCHEN PERSONSADOR THAT GOD BLESS US TOGAY AND I ALWAYS I LOVE THEM AT YOUR GRAY,joy
1146,PERSON  UNETE AL WWWEVELYNFOREVERMYFLPBIZCOM  EVELYNS PICTURES,joy
1147,I love you Irene I love Amis little sister hahaha are the most beautiful I have,joy
1148,And I defend your sure shield and I always accompany you in pain blessings,joy
1149,So that better I reserve it,joy
1150,"yes yes, if very important that there is umbrella",joy
1151,Dining and taking a swallow love calls with my bbite with rocio ramos lulo at rustica mall adventure plaza santa anita,joy
1152,Person to take a lot of photos and tag the profile There is a special prize for you,joy
1153,Flaquita Person Monchis Person and Tuty Person,joy
1154,Person celebrating my fat birthday,joy
1155,and very capable at any wise area to go in virtuous life at all times never optimize the opinion of others if you do not yours yourself your defects make you human your values and your virtues make you great,joy
1156,Coming Soon D Very soon we will have another more surprise to share them,joy
1157,"Good day I tell you we declare smiling person first of all, but because because you are there as always next to person 000 payasandu you are our greatest and cutest impulse Have a spectacular person",joy
1158,T I Love Martin Mispadres,joy
1159,"I want to wait more to express my good wishes to all you dear friends and family that have a beautiful Christmas """,joy
1160,showing person to the people around us,joy
1161,I encourage all those who do not see the light come out even if it is the moon remember that faith is the last thing that should die greetings,joy
1162,Very good days k have a super super fabulous and funny Friday kisses,joy
