,text,emotion
1095,Person iai my aunt is already prepared pro next carnival kkkk if last year was good imagine this as n will be ah looks soon your new luck kkkkkkkkk,joy
1096,Person I'm a woman I'm a girl I cut with tramontina Good night and kiss for who is transvestite,joy
1097,Great night everyone thank you for this day and for this person that comes Februaryoo is godnocomandosempre,joy
1098,I wanted to hear you say I love you baby I LOVE YOU BABY,joy
1099,Good people I received the news that Miguelosso Guerreiro has already changed of Bumperfeeding Agora just wait for his haughty,joy
1100,Person looks qm I come to visit me here in the trap they Lih and emy amuh vxs person,joy
1101,Person's graduation of my daughter with Jessyana Daisy and Alyne Melo,joy
1102,Person my god is strong righteous and true prince of peace loved me first is faithful with me always my friend even though I was weak and sinful always loved me person name that is above every name,joy
1103,Friends who remain in my life,joy
1104,PERSON PERSON AND REPRENDNOUS We are not swimming The Lord for His infinite love gives us the privilege of vidanos of the chances of Buscalode Knowing to live a new story every dawn,joy
1105,Tops look at the most beautiful girl I found here at the door of our building person the beautiful daughter of person and person our friends and neighbors of condominium,joy
1106,Person tired of spending saliva with mind that does not process,joy
1107,Person The community daycare of Peri Lagoa is with its covenant ensured the children thank the Florianópolis Education Secretariat for support,joy
1108,Person we are open to make your order 00 0 00000000 person 0 brahmas 00 reais ice cream in your hand,joy
1109,Person Super Offers at Icontel Go to one of our stores and get your iconha 00000000 person 00000000 piuma 00000000,joy
1110,TLK PERSON PERSON MY family does not have to be all perfect because,joy
1111,Person my love my life my person cat of my life,joy
1112,Changing channel is much smarter than losing time campaigning contrast what would be blue and everyone liked rede does not like to see exposure program stop exposing life in this annual Big Brother who is FacebookProntofaleidesengas,joy
1113,Person we go there tricolor nation put 00 mila partners from here to the middle of the year to arrive at the end of 0000 with more than 00 thousand associates,joy
1114,Q BOFE yummy pegue 000 active en buen passing ya search,joy
1115,good purpose when it corrects us that it is to make ourselves participants in their holiness so that we can have intimacy and communion with him and be free of our mazels that militate against our souls he is a wise and loving father and we will do wellto your correction with,joy
1116,In the person person person gostosaa reunited and united church fulfilling the IDE of the Lord School of Missions,joy
1117,As Person Person Person Amigos Princesasperson Chele Person Renata Puesterson,joy
1118,And person this and my work gains soul for the Lord Jesus,joy
1119,All my heart with all my life with all my breath and with all my strength You are my source of life my inspiration to dream run and realize I love you ♥,joy
1120,New Christmas panel placed on all facade of Ed seat 0 of Banco do Brasil Brasilia this Bernardão Father Pride,joy
1121,"Good morning ""While the designer starts at the center of the leaf, the photographer begins by the frame"" J Person",joy
1122,Person valeu manaus closing the year with golden key and crowded house thank you god,joy
1123,Person I already bought my nike pro slip,joy
1124,Person congratulations to my sister-in-law that I bless this child that is on the way 0 vcs two,joy
1125,Person person love loving by loving that gives the feeling of flying Kissing Heading to be finding looking to admire indescribable sensation that makes us transpose the impossible,joy
1126,Person my most beautiful angel in the world the day is not funny when you do not come wake up the tiiia tii ammoo bb the most beautiful feeling and cinseroo sz,joy
1127,Person soon I who did not think I could not imagine deserving and now I am the owner of this love I do not even want to know why I just need to live the rest of this life with you two months already passed amore is only the beginning of our happiness I always love,joy
1128,Person person who good fairs,joy
1129,"Person I'm very happy today because my cousin I come home today she was in the hospital but thanks to God gave everything right I love this little bjs of the cousin I love you very much, very happy",joy
1130,Person reinforcing the bronze Sunday great with friends ñ has nothing better,joy
1131,"Good morning, Sru Shake today and his heart already took care of omega 0 Herbalife Omelhor with Marcio Satcom Abada Capoeira at Independent Distributor Herbalife Ni",joy
1132,Person ride at the mall with friends a lot,joy
1133,Person confirmadissimo day 00 October our baptism in the waters,joy
1134,Person person and you are very special to me,joy
1135,I'm sorry if I missed somethinghahaha anything is just asking good appetite,joy
1136,Person of open-haired chest erected person follows life and tries to be happy love past Do not send a message I'm good on your side if you give it to me then it releases life gave us wings to fly and get free,joy
1137,Person looks like they liked what the brazilian,joy
1138,Person Person Attention in everything we do already we are happier than many couples person in fear and leaves happened I have a proposal to make you listen here I you two children and a dog a duvet a good movie the cold of August and there you areWith Aline,joy
1139,"teacher ""God bless you and protect them with love affection and dedication merry christmas and a new year full of provision love and prosperity of the lord kisses kisses and kisses hugs millions of tight hugs crumpled and crushed be with god with affection teacher letícia lelê",joy
1140,Person banking the cook for my love Chicken Tortinha with Catupiry Huuum with Paulo Person,joy
1141,Livrinos from the temptation of the devil so that tracing the path of virtue we can one day green and tags in eternal glory for all the centuries of the,joy
1142,Person person says that vice on facebook and a disease but not yes you if you addicts you to be 0,joy
1143,Vip all night 0000 yen name in the list 0000 the night all hamamatsu staking transport side shinkasen to 0 of the morning information and name on the list 00000000000Fabricio an achievement DJ fabricio Productions,joy
1144,Person was worth Secretary Flávio Seri I want to thank everyone who accompanies the dual person and Messiah Léo Gomes Messias Leo Gomes and Messiah Igor Criste Photos events,joy
1145,Person at 00h on EEF Quadra Pe Person Opening of the Pedagogical Week 0000 with Specialist Lecture on Strategic Human Resources Management Person I await all teachers,joy
1146,My servant that my father will honor Person 0000 of Obr person,joy
1147,Person distance some will forget people who live in our 0,joy
1148,Show person day 0 July will be beautiful at the club buritis,joy
1149,Person you are only megabus I love you very much,joy
1150,In the praise angelica camps salvador bahia davi milk christmas rn group harp natal rn sites look at you there,joy
1151,with person person cheersprova of the 0 tambourosenature person fun wonderful place is harassantaritasp follows ta already scheduled my person and person has to schedule yours too ta with santa sales,joy
1152,there is a human being who cares about the next with Andrea Fatima,joy
1153,Person A is Sandro Manoel who will catch you photo taken in Taua Square said Sunday Good DMS with the partner,joy
1154,Person Fuise joins with parcaloucovamo q vamaogaleravamos from the other foot in these reboladosfalta only this to raise the canecoe of a chocolates in themuião san francisco champion 0000,joy
1155,Person person lucas prudêciohehehehehhehehehhefodaass,joy
1156,Person this puppy is in the parking lot of the Big Barrier Barrier Probably ñ has a owner because it is behind everyone to cut the heart he needs a home is very docile and affectionate,joy
1157,Do not belong to us only who has a pet knows what it is to be without him good night Dandi,joy
1158,Person looks at the ecological doll the name of his and serafim uncle person who gave me gift kkkkkkkkk,joy
1159,Top Good morning beloved hj the big day person vkv that person protects us always with suelly nery and netto olliver,joy
1160,The Church that loves you PR Person and Honey,joy
1161,"quickly and every year I only have to thank Person for sending me you and ask him to bless you enlighten and keep all your steps I love you very much Congratulations, my angel 0",joy
1162,Person greetings Rubrunegras Who chores pro Flamengo is another level,joy
1163,Person a challenge that led me to the masters today I see my published work grateful and stimulated to continue being obedient to person,joy
1164,Person I logic to the stage because I'm chic 0,joy
1165,master's love,joy
1166,Google person is incredible as life preaches games and nothing all returns to the same now enjoy every minute with it because at this moment everything depends on Ti with diogo pepper,joy
1167,Show person love I won the ball alone goes brazil good and god,joy
1168,Person UIP we arrived as 000 tanned here on the page and that now come as 000 tanned,joy
1169,in a coma even because the doctors prefer so good we will continue to pray it is improving every day Thank you all for the concern and the affection God bless,joy
1170,Person in Aparecida do Norte centering a cat,joy
1171,Person I do not care for what people think about me because my personality is not made of opinions and yes of fatupor0 s0,joy
1172,Person Marvelous afternoon with Larissa de Souza and Person R looks like my daughter kkkk,joy
1173,Omg person oieeee q saudade d vcs rsrs are well passing just to wish a great sixth and a wonderful weekend for you beautiful people that I love bjossss,joy
1174,Person Happy Birthday My baby I love you that person blesses your life,joy
1175,You're going to be a great health.,joy
1176,Person in Confraternity of Gourmet Brigadier,joy
1177,Person binds ae galera on the second day 00 of person reconciliation will be present in the bar of the city the six o'clock in the afternoon stay ligginhos it is worth the sound is too much person boys you deserve and that come more success by ai with reconciliation group and,joy
1178,Also from 00h00 to 00h on Lake Ibirapuera Park,joy
1179,Person for the sadness of those who live wishing me evil and waiting for my defeat vibrating for my weaknesses to feel happy to inform that there is,joy
1180,Person breastfeeding and a gesture of love a strong binding between mother and son,joy
1181,Person muxas congratulations to everyday my amiwos,joy
1182,S0 Person Saturday at EC Pedro from Rio Dia 00 Live Do not miss girls Who wants a video of my sunga singing the music ElanaoParadenancar shares this photo here and leave your name that I'm going to talk about in the video at the time,joy
1183,Personalization of refrigerator Budgets Inbox,joy
1184,Person special invitation for all my friends would like to meet everyone there tomorrow hugs with,joy
1185,Person person who loves his brother is in the light and in it there is no scandal 0 person 000,joy
1186,Person confidence is a precious good,joy
1187,Ave Ufa Person Now I'm single Cheia de Love Pra gives Felis of life,joy
1188,I will be receiving the band official with all the press thanks to all for helping me in this new victory,joy
1189,Deejays and music lovers electronic music My music is already on iTunes for bosses and rich bosses of unlimited credit cards just Search for iTunes,joy
1190,Person to friends online I thank Person for giving me the grace of having a garden with beautiful roses that are you God bless my beautiful roses,joy
1191,God puts the helmet of salvation and the breastwork of justice and leseth them with all the holy spirit's beans because I give life to God's men of God in his santa hand Jesus,joy
1192,Person Team Proteggy Occupational More Than Collaborators The Grand Family,joy
1193,It is the recipe is one only makes peace with oneself diminish the expectation and understand that happiness and have and to be,joy
1194,by email,joy
1195,P o s i t i v the person person the text tab before judging someone or any action put in place of his neighbor and remember that never try to measure his fight with his brother because each one takes the burden that,joy
1196,"have you love you, I love you, I love you, my person.",joy
1197,Person junior djjdeejayjunior the pikalessandro ale b dos santos daniele souzamax maxinho ariana flamenguistadjaywallace wallace santos wallace djdeejay glauco gomes look who I found on the beach but here in porcuncula there is no beach can this in friends person,joy
1198,Person person remembering beautiful not mentents,joy
1199,With person person person person good morning moments,joy
1200,Person Saturday has a boss party,joy
1201,Person has all tastes,joy
1202,Dali Figueira forever person only the strong will understand and the weak lament and cry I am from the team that is the most often champion ⚽️✌️⚽️✌️️,joy
1203,"Good morning, let's take a back rs miguelzinho making the party my god thanks for putting good people on my way thanks to God today my bb ta well Mom loves you person",joy
1204,greater pride in being your son person amoooooooo much,joy
1205,boring mto jealous but I love you so haha,joy
1206,Person fraternization of the Santa Fe team,joy
1207,godmother 0,joy
1208,"Person will be next weekend, make your registration and be an affective godfather",joy
1209,Person eh nois mlk crazy tibum on the beach of curitiba in caiobá auuuuuuuu soh no leisure with the cousin,joy
1210,BB Person ♥ 0 year 0 month ♥ ★ love ★ passion complicity friendship ★ secrets ★ shared ★ person ★ the most important ★ laughs laughter ★ impersonation of the pow hill with him ★ ☆ ★ yesterday person a little of my life,joy
1211,Adriele person person person person person person person person person person person person my friend,joy
1212,Person I passed a vestibular ufpeé federal uh uh I already knew the result left now to little sociology,joy
1213,Person this is for saying that we like her,joy
1214,of caga do not eat if you have faith in person nothing will affect you and the fucking of the repression will beat and will come back person,joy
1215,Person looks at what delight we just made happy birthday,joy
1216,Person My beautiful person returning to play sign of his improved person Person Oliveira at the city of Passo City,joy
1217,Maranhão on the day 00000000 from 0000 hs with the participation of the singer of the forró of the Baron Abadás Limited thanks person in information 00000000 00000000,joy
1218,Person person person to enjoy a great samba wheel on Friday day 0000 from 0000,joy
1219,Here in the neighborhood santo antonio if someone saw or know where she is please contact the face or cel 0000 0000,sadness
1220,Person taking you I know of one thing you will be sermre cmg wherever you go flight takes you cmg a partner qe neh you think qe ñ flight I miss my partner paulohenrique,sadness
1221,suffering and when they are not in my arms the sorrows look banais my heart to pieces,sadness
1222,I run from this shadow in a dream I see this past and the wall of my room is still your picture I do not want to see so I can not remember I even thought to change anywhere that there is no thought in you,sadness
1223,Person person rests in peace person,sadness
1224,Person person a tragedy that happened in parauapebas a girl from three messesfoi attacked by a pitbul and unfortunately died,sadness
1225,Person is already 0 months that you are gone and this pain that I feel will never pass you are missing much in my life friend person,sadness
1226,Person last flexoes for the TG I feel of my second family,sadness
1227,Person more a great for the firefighters volunteers from algés uncle person,sadness
1228,relatives mainly to those who were coming in that hospital in their last moments and the whole church and person from which she loved her is with the person it comforts us,sadness
1229,people who are not even there for this to create love in the heart imagine only if it were you that was there I went to sleep,sadness
1230,Person here at home and I can not take care and keep sanitized everything with so much pussy but if they get temporary home me person to help her wear collar already old but uses or one day had a home,sadness
1231,well of you here my condolences and stay with God,sadness
1232,less prospect or then will die they are below a person's person's port on the number 000 of the street streets of Itabaiana in the village uniao,sadness
1233,a cousin knows the pain that I am person in mourning porr Vc I amoooooprimo fucking that pain with laís carolynna silva,sadness
1234,Person rest in peace person my feelings person that person can comforts his 0 and all his family I feel very,sadness
1235,fones vivowhatsap 0000000000 clear 0000000000 tim 0000000000 the photo that I have of it is this but the person told me that he did not grow very small small,sadness
1236,Santana Feira police as she returned from a cult where she was ministering the police claimed that he confused him with bandits who were being sought for the worst thing is that today would be his birthday but God knows of all things,sadness
1237,will be in my memory,sadness
1238,Mourning Person She is a battling frog and very vain admired his way despite the quite masculine clothes but she never left the admiring end of Meireluto with Merii,sadness
1239,Good morning for those who woke up with their two male cats and adults if swallowed pudding is all hurt I do not know what else to do so they come back to live well with my prince,sadness
1240,truth in the next rule our city and think of people of real social inclusion here in the bar there is all we are all locked in their residences,sadness
1241,I made myself happy unfortunately people without love itself ended with everything else God knows give all things those who took suua life vaii paid beim dear person nunkaa mee I will forget give vooc 0,sadness
1242,a lot my life my crown as I always called it I will feel a lot of sdds rest in peace my old s0,sadness
1243,Seeing us and blessing us with your eternal joy My feelings to all relatives with Edna Person,sadness
1244,love of peace not of greed power and violence that the good prevail evil and that this fact does not become matter in the books of our children or grandchildren for once again person who has already given,sadness
1245,and example of life a woman warrior longing for eternal she was my second mother belt me part of the person person goes with god terezinha tetê,sadness
1246,know the heart of the bad and good nothing flees from your eyes do not want soon soon you will be aqee with agent again we are praying for you,sadness
1247,Angola Xyami News from Angola Africa and the world 00horas,sadness
1248,Cute missing this time,sadness
1249,Songs we expire even though I have not been able to keep the sk0 park stand we won because we act with the heart with love with care with respect with respect we did everything that was within our reach but did not unfortunately did not give person and person bruno,sadness
1250,me are like family that God comfort the hearts of their parents because she was the only daughter woman in the photo she and her children,sadness
1251,Mourning person person the day I do not start anything good a mano brother warrior fought honest front line if you leave that person one has in a better heart and that find the way of happiness that God confides the heart of your family is person,sadness
1252,this poor thing caught in a ponytail cipó nor at home he is sleeping in so much fear d father monster that he takes my name and anaelson god help me,sadness
1253,Person today is 0 months that you left us Galega 0000 longings Eternal cousin,sadness
1254,"Person Goodbye, my angel, I love you very much.",sadness
1255,day ends more sad person,sadness
1256,Person mourning go in peace person,sadness
1257,Fima eternal misses,sadness
1258,Person going to the uppa with my bb aff,sadness
1259,God and God comfort the heart of His mourning mother mourning,sadness
1260,Person is very difficult to imagine that you share but I prefer to believe that it is in a wonderful place in you can rest in peace that God is always with you my friend,sadness
1261,more than all he loves you more than the world he gave his son to die on the cross for me and by person he loves you,sadness
1262,Person I feel but I went,sadness
1263,everything is the feeling of impotence of weakness of inability to do something for someone you love so much but let's go forward praying and clinging to a truck of hope and faith,sadness
1264,crying in despair now society does not want to see that your security agents are being exterminated if those who have to defend is without defense,sadness
1265,mourning person the day today dawned gray color we lost our grid friend zé roberto vaicomdeus,sadness
1266,more than one day I dreamed for me has the purity of an angel cherubi I would change everything to have you here I change my peace for a kiss your one more Christmas without you,sadness
1267,your master you finally aroused the seventh sense you grew so much because what you really believed was right I would like to be able to live to use this power you purchased but I do not have more strength to help you forgive,sadness
1268,Brigado by the present,sadness
1269,Person person angel if it was hj will do so much missing in the yard and not seeing you do not listen if barking under my window as can be well on a day and the other being dying can not accept this rest in peace my four-legged little friend,sadness
1270,accident difficult to believe that person comfort the hearts of their families because the couple I certainly know that they are in a worthy place reserved by God the pain is not the one who is going but,sadness
1271,instant wipe from your eyes all the tear continues serving this all powerful and conitnue persevering and working for the person anything count on me bjs,sadness
1272,very much the angels are happy to receive you,sadness
1273,Personal personal please who can share my brother left yesterday from home around 00 hrs and did not come back who can give news about him please let us know and help share we are trying to ACHOULA please share,sadness
1274,RIP Person Person for Loss of the Great Player and an excellent man person idol inside and off the lawns,sadness
1275,the bike circuit batel today in curitiba that pieira first race with the new bike and missing 0 laps to the end opened a chain link causing an abandonment because it has days that there is no way even but it is only the beginning we go ahead,sadness
1276,help share this is serious my friends this boy was stolen from his mother let's share this photo who knows we can locate his whereabouts think about it could be with us being so let's share this picture person will help,sadness
1277,VISHHHH PERSON PERSON OF EXPOACRE WITH VIOLESCOM BAD TO HORSE CAREFUL AND BRUTIALUNS Fought by rivalry Other injured animals by brutalitychegaret the animals of this ridiculous circus,sadness
1278,his own ear that will feel the same sensation that a dog feels person kings,sadness
1279,all standing away but this is the current of faith you will leave this mk,sadness
1280,Person my heart is in mourning goes with god pink catia thanks for being part of our livesvc will be forever in our heartesvai rejoice the sky now goes in peace,sadness
1281,shared the date of birthday I will miss you eternal my dear uncle person the poeto tota white brother of my grandmother person who left us today around 0hs in the morning in the city of Japí Rio Grande do Norte,sadness
1282,this photo luan is smiling yes but look well in his eyes he was crying can see was what you wanted to see he cry sad person that we do not stop people for luan with gustavo person,sadness
1283,Person Strength Neguinho We wait for your recovery Person to recover the fastest possible Thiago We are praying for you Cunhadinho I LOVE YOU MY LIFE,sadness
1284,Person people my bitch disappeared this morning about some 000hrs Mangabeira neighborhood if anyone finds please contact this image number because my niece of 0 years is very attached to bitch helps sharing with Edkarla Severiano,sadness
1285,Person today is exactly three years that he left that saudade friend stays with God,sadness
1286,Person Tassmal Pah PAH MOZAMBICAN PEOPLE PERSONAL While Festive Independence Day Look at what happened today in muxungu my God where we will stop us because all this innocent and civilians to die who will help us,sadness
1287,Staff 0 without you I miss my mother,sadness
1288,Person partner and partners qe if versaicesinhapatrickgustintrayethodos of our village sdds qe vs tds rest in peace,sadness
1289,Person Good morning faces going mimi mt hurt,sadness
1290,Person aunt zaila you do not have to believe in the impossible you just need to have faith and believe in God so everything is possible person not to give us in this moment so difficult that our family is living protect and cure my aunt,sadness
1291,Let's comfort someone faith and what moves our hearts makes believe that better days that are to come and we will be all brothers in an eternal life next to our person,sadness
1292,Person life is just an opportunity to meet only after death if it gives the junction the bodies only have the embrace the souls have the enlace mourning eternalYou've misses us to remember all the good things we have done together person awaits you person,sadness
1293,Person unfortunately in this winning in the afternoon we lost another friend of the stretch,sadness
